C F Hg O        , 10.072,    0.407,
La N O Ti       , 10.078,    0.407,
C I O Y         , 10.081,    0.407,
Bi Br O Sr      , 10.094,    0.408,
F La Mo O       , 10.094,    0.408,
C F O Ru        , 10.096,    0.408,
N Nd O V        , 10.104,    0.409,
C N Pb S        , 10.105,    0.409,
Br O W Yb       , 10.107,    0.409,
Cl O Re Re      , 10.115,     0.41,
Ce I N O        , 10.121,     0.41,
C F O Pb        , 10.125,     0.41,
C N S Tl        , 10.132,    0.411,
B Br O Sr       , 10.136,    0.411,
F Mo Na O       , 10.136,    0.411,
B Cl N N        , 10.143,    0.412,
F La N Si       ,  10.15,    0.412,
C N O S         , 10.151,    0.412,
C F O Tl        , 10.152,    0.412,
B F N O         , 10.153,    0.412,
F O Pb W        , 10.154,    0.412,
Eu N O Ti       ,  10.17,    0.414,
Eu Eu I O       , 10.174,    0.414,
Ba Cl O Si      , 10.175,    0.414,
Ba O S Zn       , 10.178,    0.414,
La N O Zr       , 10.186,    0.415,
Eu F Mo O       , 10.186,    0.415,
Br Na O W       , 10.199,    0.415,
B Br Eu N       , 10.202,    0.416,
C Cl O Re       , 10.207,    0.416,
Eu Eu F S       , 10.213,    0.416,
Li N O V        , 10.217,    0.417,
Al F O Sr       , 10.218,    0.417,
Mn N Nb O       , 10.218,    0.417,
I La N O        , 10.219,    0.417,
As Ba O Ti      , 10.221,    0.417,
Ba Cl O Sb      , 10.222,    0.417,
Mo N O Y        , 10.226,    0.417,
C I Mn O        ,  10.23,    0.418,
Ba Cl Cu O      , 10.232,    0.418,
Cu F O Sr       , 10.234,    0.418,
Ba Cl In O      , 10.235,    0.418,
Ba I P P        , 10.238,    0.418,
Ba O P S        , 10.251,    0.419,
N O P Th        , 10.259,     0.42,
Ba Cl O P       , 10.262,     0.42,
F O P Sr        , 10.263,     0.42,
La N O V        , 10.268,     0.42,
As C F N        , 10.279,    0.421,
Ag Ba F Se      , 10.281,    0.421,
C I O Os        , 10.285,    0.421,
C C O S         , 10.289,    0.422,
Mo N O Sm       , 10.289,    0.422,
As O Sr Ta      , 10.293,    0.422,
Li N Nb O       , 10.294,    0.422,
As Ba Cd F      , 10.305,    0.423,
As Ba F Zn      , 10.305,    0.423,
F O Os Os       , 10.314,    0.423,
Cl Hf N Na      , 10.318,    0.424,
Bi I O Sr       , 10.322,    0.424,
B Ca I N        , 10.329,    0.424,
B La N O        , 10.332,    0.425,
Ca N Nb O       , 10.335,    0.425,
Hg N N O        ,  10.34,    0.425,
Ba Cl O Te      , 10.341,    0.425,
La N Nb O       , 10.344,    0.425,
Cl Mn O Sr      , 10.345,    0.425,
N O Sc Ta       , 10.346,    0.425,
Bi F S Sr       , 10.361,    0.426,
Cr Li N O       , 10.363,    0.427,
Ba Br O Si      , 10.367,    0.427,
Ba F Sb Se      , 10.378,    0.428,
O Se Sm U       , 10.383,    0.428,
Eu F Nd O       , 10.383,    0.428,
Ba Cu F Se      , 10.388,    0.428,
Ba F In Se      ,  10.39,    0.428,
Br C O Re       , 10.399,    0.429,
B Eu N O        , 10.422,    0.431,
Ba Br Cu O      , 10.424,    0.431,
Ba Br In O      , 10.426,    0.431,
B Eu I N        , 10.428,    0.431,
Eu N Nb O       , 10.434,    0.431,
Ga N O Sr       ,  10.45,    0.433,
Ba Br O P       , 10.453,    0.433,
As F Mn Sr      , 10.461,    0.433,
F Nd O Ta       , 10.464,    0.434,
Ba Bi O Se      , 10.469,    0.434,
As B Ba O       , 10.471,    0.434,
Br Cl N Sr      , 10.474,    0.434,
C Hg N O        , 10.476,    0.434,
In K Se Te      , 10.479,    0.435,
As Ba Nb O      , 10.483,    0.435,
Ba Mn S Se      , 10.488,    0.435,
Ca Mo N O       , 10.489,    0.435,
Br C O W        , 10.518,    0.437,
Ba Br O Te      ,  10.53,    0.438,
Ba F Se Sn      , 10.531,    0.438,
Cl F N Re       , 10.536,    0.438,
Mo N Na O       , 10.538,    0.439,
Eu F La O       , 10.543,    0.439,
Ba Mn Se Te     , 10.546,    0.439,
C N O Tl        , 10.553,     0.44,
Cl Eu O Sr      , 10.559,     0.44,
Ba O S Ti       , 10.559,     0.44,
F O Sr Ti       ,  10.57,    0.441,
F Li O Ta       , 10.574,    0.441,
F Ni O Sr       , 10.574,    0.441,
N O Si Sr       , 10.576,    0.441,
Ag Ba F S       , 10.579,    0.441,
Ce F N O        ,  10.58,    0.441,
Er O S U        , 10.594,    0.442,
Ba Cl Hg O      , 10.602,    0.443,
Ca F O Ta       , 10.614,    0.444,
C F N S         , 10.615,    0.444,
O S U Y         , 10.617,    0.444,
K Se Sn Te      , 10.619,    0.444,
Ba Cd F P       , 10.621,    0.444,
C I O Re        , 10.622,    0.444,
Ba Cl O Ru      , 10.626,    0.445,
F O Ru Sr       , 10.627,    0.445,
Ag Ba F Te      , 10.636,    0.445,
Ba Cu I O       , 10.646,    0.446,
Ba Cl F Zn      ,  10.65,    0.446,
F O Sb U        , 10.651,    0.446,
N O P Sr        ,  10.66,    0.447,
F O Sc Sr       ,  10.66,    0.447,
F Na O Ta       , 10.663,    0.447,
F Li O Re       , 10.669,    0.447,
Ba I O P        , 10.674,    0.448,
Ba Cl O Tl      , 10.679,    0.448,
Ba Cu F S       , 10.683,    0.448,
C F Mn O        , 10.684,    0.449,
Ba F In S       , 10.685,    0.449,
F N Na Zr       , 10.688,    0.449,
Ba Cl Cu F      , 10.693,    0.449,
C Ce F O        , 10.712,     0.45,
Cl F Sm Sr      ,  10.72,    0.451,
Cl O Re Sr      , 10.733,    0.452,
Cl Nd O U       , 10.734,    0.452,
I N Na Nd       , 10.734,    0.452,
Ba Cu F Te      ,  10.74,    0.452,
Ba O S V        ,  10.74,    0.452,
Ba Cl O V       ,  10.75,    0.453,
F O Sr V        , 10.751,    0.453,
I Se Ta U       , 10.762,    0.454,
F O Te U        , 10.765,    0.454,
Cl O Pr U       , 10.766,    0.454,
I N Na Pr       , 10.766,    0.454,
Ba Bi Cl O      , 10.772,    0.454,
F Mn P Sr       , 10.772,    0.455,
C Ca N S        , 10.778,    0.455,
B Ca F N        ,  10.78,    0.455,
Cl In K Te      , 10.782,    0.455,
B Ba O P        , 10.782,    0.455,
F Li O W        , 10.785,    0.455,
C Cl La N       , 10.796,    0.456,
C Ca F O        , 10.796,    0.456,
Ce I N Na       , 10.797,    0.456,
B Cl N Sr       , 10.803,    0.457,
C F La O        , 10.805,    0.457,
N O Sm Ta       , 10.809,    0.457,
Ba Br O Ru      , 10.811,    0.457,
B Ba Cl O       , 10.811,    0.457,
B F O Sr        , 10.812,    0.457,
Ba Nb O S       , 10.813,    0.457,
Ce F S Sr       , 10.819,    0.458,
Ba F S Sn       , 10.822,    0.458,
C N Na S        , 10.826,    0.458,
O S U Yb        , 10.832,    0.459,
Br Cl K Pd      , 10.847,     0.46,
Hf N O Ta       , 10.848,     0.46,
As Cl K O       , 10.848,     0.46,
As Ba Mn O      , 10.858,     0.46,
Cl N Na W       , 10.863,    0.461,
F Na O W        , 10.872,    0.461,
C Eu N S        , 10.873,    0.461,
K O S Se        , 10.875,    0.462,
Br I N Sr       , 10.878,    0.462,
C Cl Eu N       , 10.882,    0.462,
N O Pr Ta       , 10.886,    0.462,
Cl La O U       , 10.888,    0.462,
Mn N O Ta       , 10.889,    0.462,
I La N Na       , 10.889,    0.462,
Cr F O Sr       ,  10.89,    0.463,
C N O Tm        , 10.906,    0.464,
C Er N O        , 10.906,    0.464,
Ba F Ga O       , 10.909,    0.464,
Ca Cl F Sr      , 10.912,    0.464,
C Dy N O        , 10.913,    0.464,
Ce N O Ta       , 10.916,    0.464,
C N O Y         , 10.928,    0.465,
C Ho N O        ,  10.93,    0.465,
F N O Re        , 10.931,    0.465,
Ba Br Cl F      , 10.932,    0.465,
C I N Y         , 10.934,    0.466,
Bi K S Se       , 10.949,    0.467,
Ba Bi Br O      , 10.954,    0.467,
Li N O Ta       ,  10.96,    0.467,
B Br N Sr       , 10.985,    0.469,
C N O Sm        , 10.987,    0.469,
B Ba Br O       , 10.993,     0.47,
Ca N O Ta       , 10.999,     0.47,
La N O Ta       , 11.007,    0.471,
Ba F O Pd       , 11.015,    0.471,
Ba Cl F Ni      , 11.019,    0.471,
As Br K O       , 11.029,    0.472,
Er F O Sr       , 11.029,    0.472,
C N Nd O        , 11.032,    0.472,
As Co Ni S      , 11.033,    0.472,
F N O W         , 11.044,    0.473,
F O Sr Y        , 11.051,    0.473,
K O S Si        , 11.059,    0.474,
N Nd O W        , 11.059,    0.474,
C N O Pr        , 11.064,    0.474,
Ce F Mn N       , 11.075,    0.475,
F O U Zr        , 11.083,    0.476,
Ba F In O       , 11.085,    0.476,
N O S U         ,  11.09,    0.476,
F O Tl U        ,  11.09,    0.476,
Eu N O Ta       , 11.092,    0.476,
Ba Cl N P       , 11.101,    0.477,
K O S Sb        , 11.102,    0.477,
Al Cl K O       , 11.107,    0.477,
Ba Cl O Sm      , 11.108,    0.477,
Ba F O P        ,  11.11,    0.478,
Cl O Pu Te      , 11.116,    0.478,
Cl Cu K O       , 11.122,    0.478,
C C Cl N        , 11.136,    0.479,
C Li N O        , 11.136,    0.479,
C N O Yb        , 11.137,    0.479,
As Ba O Ta      , 11.138,    0.479,
K O P S         , 11.139,    0.479,
Au Br Cl K      , 11.154,     0.48,
K O S S         , 11.157,    0.481,
As Cl Co O      , 11.161,    0.481,
N O W Yb        , 11.164,    0.481,
Ba Bi I O       , 11.165,    0.481,
C Ca N O        , 11.175,    0.482,
C La N O        , 11.183,    0.482,
Ba Cl Mn O      , 11.186,    0.483,
F Mn O Sr       , 11.187,    0.483,
B N O Sr        ,  11.19,    0.483,
B I N Sr        , 11.196,    0.483,
Cl Co O Se      , 11.197,    0.483,
N Nb O Sr       , 11.201,    0.484,
Ca N O W        , 11.201,    0.484,
La N O W        ,  11.21,    0.484,
C N Na O        , 11.221,    0.485,
Ba Cl O Os      , 11.237,    0.486,
As I K O        , 11.238,    0.486,
N Na O W        , 11.247,    0.487,
B Ba Cl F       , 11.248,    0.487,
C Eu N O        , 11.266,    0.488,
C Eu I N        , 11.272,    0.489,
Ba Br F Pb      , 11.273,    0.489,
Ba Br N P       , 11.278,    0.489,
Ba Ga N O       , 11.283,    0.489,
Ca Cl N Sr      , 11.286,     0.49,
Ca N O Th       , 11.291,     0.49,
Eu N O W        , 11.292,     0.49,
Ba O Te Yb      , 11.301,    0.491,
Ba Br Cl N      , 11.306,    0.491,
Br C C N        , 11.313,    0.491,
Ba Br F I       ,  11.32,    0.492,
Mo N O Sr       , 11.343,    0.493,
As K Nb O       , 11.353,    0.494,
Ba Br O Pr      , 11.359,    0.494,
F F N Re        , 11.364,    0.495,
Co Cr S Se      , 11.371,    0.495,
Br Co O Se      , 11.372,    0.495,
F Np O P        ,  11.39,    0.497,
Ba F O Ti       , 11.394,    0.497,
Ba N O Si       ,   11.4,    0.497,
Ba N O Zn       , 11.412,    0.498,
K O S Ti        , 11.422,    0.499,
C N O Re        , 11.429,    0.499,
Cl Co O P       , 11.453,    0.501,
Ba Cl O Ta      , 11.458,    0.501,
Br Ca N Sr      ,  11.46,    0.501,
Ba N O P        , 11.478,    0.503,
Ba F O Sc       , 11.478,    0.503,
Ba F I Pb       , 11.478,    0.503,
Ba I N P        , 11.483,    0.503,
Cl K O Ru       , 11.485,    0.503,
B Cl Cm O       , 11.514,    0.505,
Cl Co O Te      , 11.524,    0.506,
Cl F K Sb       , 11.537,    0.507,
Ba Cl O Re      , 11.545,    0.507,
Ba Br Eu I      , 11.562,    0.508,
Ba F O V        , 11.563,    0.508,
Ba Bi F O       , 11.583,     0.51,
Br Co O Sb      , 11.589,     0.51,
K O S V         ,  11.59,     0.51,
C F La N        , 11.606,    0.511,
C N S Sr        , 11.611,    0.512,
B Ba Cl N       , 11.611,    0.512,
B F N Sr        , 11.612,    0.512,
B Ba F O        , 11.619,    0.512,
Bi Cl K O       ,  11.62,    0.512,
C Cl N Sr       ,  11.62,    0.512,
Ba C Cl O       , 11.627,    0.513,
C F O Sr        , 11.628,    0.513,
Ba F Nb O       ,  11.63,    0.513,
Cl F K Te       , 11.642,    0.514,
K O Te V        , 11.643,    0.514,
Ba Cl O W       , 11.652,    0.514,
As F K O        , 11.654,    0.515,
B Cl K O        , 11.656,    0.515,
Cl K Nb O       , 11.667,    0.515,
Cl F K Sn       , 11.675,    0.516,
Ba Br I N       , 11.681,    0.516,
C Eu F N        , 11.686,    0.517,
F K O Se        , 11.688,    0.517,
Br Co O Te      , 11.694,    0.517,
Cl K O Tc       , 11.708,    0.518,
Ba Ca Cl F      , 11.712,    0.519,
Ba Br O Re      , 11.716,    0.519,
Cl K Re Se      ,  11.72,    0.519,
Cl Cr K O       , 11.728,     0.52,
Au I K O        , 11.729,     0.52,
Ba N O Ti       , 11.753,    0.521,
Ba Cl F Na      , 11.756,    0.522,
Bi Br K O       , 11.789,    0.524,
K Mo O S        , 11.794,    0.524,
Ba Cl Eu F      , 11.799,    0.524,
Cl K Mo O       , 11.803,    0.525,
N O Sr Ta       , 11.816,    0.526,
B Br K O        , 11.825,    0.526,
F N N W         , 11.829,    0.526,
Ba Br Ca F      ,  11.88,     0.53,
F N O U         , 11.888,     0.53,
Al F K O        , 11.895,    0.531,
F K O Sb        ,   11.9,    0.531,
Ba Br Cl Sr     , 11.901,    0.531,
Ba N O V        , 11.916,    0.532,
As Co O Sm      , 11.918,    0.533,
Cl F K Pb       , 11.921,    0.533,
F K O P         , 11.934,    0.534,
B Cl Co O       , 11.948,    0.535,
F K O S         , 11.951,    0.535,
As Co Nd O      , 11.959,    0.535,
Ba Br Eu F      , 11.966,    0.536,
Ba F Mn O       , 11.969,    0.536,
Br K Mo O       ,  11.97,    0.536,
B Ba N O        , 11.971,    0.536,
C N O Sr        ,  11.98,    0.537,
Ba N Nb O       , 11.982,    0.537,
Cl K Re S       , 11.982,    0.537,
Bi I K O        , 11.985,    0.537,
Ge K N O        , 11.998,    0.538,
F K O Te        , 12.002,    0.538,
Cl K O Pr       , 12.002,    0.538,
N O Sr W        , 12.005,    0.538,
K N O Se        , 12.038,    0.541,
Cl K O Os       , 12.052,    0.542,
Cl F K Nb       , 12.073,    0.543,
Br F K Pb       , 12.086,    0.544,
As Co La O      , 12.098,    0.545,
B Br Co O       , 12.112,    0.546,
Ba Mo N O       , 12.115,    0.546,
O Te U U        , 12.123,    0.546,
Co La O Se      , 12.131,    0.547,
Cl Cr F K       , 12.132,    0.547,
Br K Re S       , 12.146,    0.548,
Co F O Sb       , 12.186,    0.551,
Cl K N Ti       , 12.191,    0.551,
F K O Ti        , 12.199,    0.552,
Ba Cl N Ta      , 12.216,    0.553,
Co F O P        , 12.219,    0.553,
Ba F O Ta       , 12.224,    0.553,
Br Cl K W       , 12.257,    0.556,
F K O Zr        , 12.288,    0.558,
K N O S         , 12.294,    0.558,
Cl K N O        , 12.302,    0.559,
B Co I O        , 12.304,    0.559,
Ba F O Re       , 12.306,    0.559,
F I K O         , 12.315,     0.56,
Cl K O Re       ,  12.34,    0.561,
F K O V         , 12.356,    0.562,
Ba N O Os       , 12.357,    0.562,
Ba C N S        , 12.366,    0.563,
B Ba F N        , 12.367,    0.563,
Co La O P       , 12.368,    0.563,
F Na Np O       , 12.369,    0.563,
Bi F K O        , 12.375,    0.564,
Ca Co O S       , 12.377,    0.564,
Ba C F O        , 12.382,    0.564,
Ba Cl N W       , 12.398,    0.565,
Ba F O W        , 12.406,    0.566,
B F K O         ,  12.41,    0.566,
Co Na O S       , 12.419,    0.567,
F K Nb O        , 12.419,    0.567,
Cl K O W        , 12.441,    0.568,
Br Cl Cu Rb     , 12.455,    0.569,
F K O Tc        , 12.458,    0.569,
As O Rb Sn      , 12.467,     0.57,
Cr F K O        , 12.477,    0.571,
Ba Cl F Sr      , 12.483,    0.571,
Br Cl Rb Te     , 12.544,    0.575,
F K Mo O        , 12.548,    0.575,
Ba N O Ta       , 12.559,    0.576,
Cl Co N O       , 12.579,    0.578,
Ba N O Re       , 12.639,    0.582,
Cl Cu I Rb      , 12.641,    0.582,
O Rb Sb Te      , 12.668,    0.584,
C Co O S        , 12.682,    0.585,
F Hf K O        , 12.703,    0.586,
Cl F K Re       , 12.725,    0.587,
Ba N O W        , 12.736,    0.588,
Ce F K O        , 12.761,     0.59,
Br Cd I Rb      , 12.761,     0.59,
Cl K N Os       , 12.775,    0.591,
As Co La N      , 12.818,    0.594,
Br Mo Rb Se     , 12.819,    0.594,
C K N Se        , 12.872,    0.598,
K Mo N O        , 12.874,    0.598,
Co S Se U       , 12.879,    0.598,
Co I N O        , 12.917,    0.601,
Br Nb Rb S      , 12.936,    0.602,
F K O Ta        , 12.977,    0.605,
Br Cl Cr Rb     ,   13.0,    0.606,
Cl F Rb Sb      , 13.004,    0.606,
F K N O         , 13.018,    0.607,
F K O Re        , 13.054,     0.61,
K N O Os        , 13.103,    0.613,
Br Mo Rb Te     , 13.106,    0.613,
As F O Rb       , 13.107,    0.614,
C K N S         , 13.111,    0.614,
Cl Co O Sr      , 13.117,    0.614,
Cl Nb O Rb      , 13.119,    0.614,
C F K O         , 13.126,    0.615,
F O Rb Se       , 13.138,    0.616,
Br F Rb Sb      , 13.155,    0.617,
Cl Cr O Rb      , 13.173,    0.618,
Cl Cr I Rb      , 13.178,    0.618,
Cl K O U        , 13.195,     0.62,
Mo O Rb S       , 13.232,    0.622,
Br Co O Sr      , 13.267,    0.624,
Br C K N        , 13.269,    0.625,
Cu Fe S Se      ,  13.31,    0.627,
Fe In S Se      , 13.312,    0.627,
F O Rb Sb       , 13.326,    0.628,
F O P Rb        , 13.357,    0.631,
Br K N Th       , 13.367,    0.631,
C Co N S        , 13.371,    0.631,
F O Rb S        , 13.372,    0.632,
C Cl Co N       , 13.379,    0.632,
C K N O         , 13.439,    0.636,
K N O W         , 13.461,    0.638,
Ag Fe S Te      , 13.505,    0.641,
Cl F Sb Xe      , 13.545,    0.643,
Br Rb Re S      , 13.547,    0.643,
Cl N Rb Ti      , 13.587,    0.646,
As F O Xe       , 13.645,     0.65,
Fe S Se Tl      , 13.656,    0.651,
Cl Cs Ga Se     , 13.672,    0.652,
F O Rb Zr       , 13.674,    0.652,
F O Se Xe       , 13.674,    0.652,
N O Rb S        , 13.679,    0.652,
F I O Rb        , 13.699,    0.654,
O Rb Re S       , 13.714,    0.655,
Fe O Se Te      , 13.715,    0.655,
F O Rb V        , 13.736,    0.656,
Ba Co O S       , 13.782,     0.66,
Ba Cl Co O      ,  13.79,     0.66,
Co F O Sr       , 13.791,     0.66,
F Nb O Rb       , 13.792,     0.66,
Cr Fe S Se      , 13.821,    0.662,
Cr F O Rb       , 13.844,    0.664,
F O Sb Xe       , 13.855,    0.664,
Cl Fe O Sb      , 13.859,    0.665,
F K O U         , 13.865,    0.665,
Cl Fe O P       , 13.888,    0.667,
F O S Xe        , 13.899,    0.667,
F Mo O Rb       , 13.908,    0.668,
F O Te Xe       , 13.943,     0.67,
Cl Fe O Te      , 13.947,    0.671,
Br Fe O Sb      , 14.001,    0.674,
F Hf O Rb       , 14.048,    0.678,
Fe Mn S Se      , 14.056,    0.678,
Br Fe O Te      , 14.088,     0.68,
Ce F O Rb       , 14.101,    0.681,
Bi Br Fe S      , 14.102,    0.681,
Ba Cl Co F      , 14.135,    0.684,
Fe I O Sb       , 14.167,    0.686,
Cl Fe O Pb      ,  14.18,    0.687,
Br Cl Cs Cu     , 14.183,    0.687,
As Cs O Sn      , 14.193,    0.687,
As B Cs P       , 14.196,    0.688,
Mo N O Rb       , 14.203,    0.688,
As Fe O Tb      , 14.236,     0.69,
As Fe Gd O      , 14.243,    0.691,
Bi Cs Se Te     , 14.251,    0.691,
As Fe O Sm      , 14.274,    0.693,
Cl Cs I Pd      , 14.294,    0.694,
F O Rb Ta       , 14.297,    0.695,
As F Fe O       , 14.297,    0.695,
B Cl Fe O       , 14.299,    0.695,
Fe O Se Sm      , 14.302,    0.695,
Ce Cl Fe S      , 14.304,    0.695,
As Fe Nd O      , 14.308,    0.695,
Cl Fe N Se      , 14.319,    0.696,
F Fe O Se       , 14.325,    0.696,
As Fe O Pr      , 14.333,    0.697,
Fe Nd O Se      , 14.337,    0.697,
F O Tc Xe       , 14.338,    0.697,
Cl Cs Cu I      , 14.346,    0.698,
Cs O P S        , 14.355,    0.699,
As Ce Fe O      , 14.356,    0.699,
Cs Mo S Se      , 14.359,    0.699,
Fe O Pr Se      , 14.361,    0.699,
Cl Fe La S      , 14.374,      0.7,
Ce Fe O Se      , 14.384,      0.7,
N O Os Rb       , 14.411,    0.702,
F K Np O        , 14.412,    0.702,
Cl Cs Dy Se     , 14.416,    0.703,
Cl Fe Mo O      , 14.419,    0.703,
As Fe La O      , 14.425,    0.703,
Br Cs Se Tc     , 14.426,    0.703,
Cl Cs Ho Se     , 14.429,    0.704,
Br Cs I Pd      , 14.432,    0.704,
C F O Rb        , 14.432,    0.704,
Ba Co F O       , 14.432,    0.704,
B Br Fe O       , 14.437,    0.704,
Br Ce Fe S      , 14.442,    0.704,
Ca Fe O Se      , 14.446,    0.705,
Br Cl Cs Hg     , 14.452,    0.705,
Fe La O Se      , 14.453,    0.705,
F O Rb W        , 14.453,    0.705,
Cl Cs Nb S      , 14.471,    0.706,
Fe Na O Se      , 14.482,    0.707,
Br Cs Mo Se     , 14.503,    0.709,
Fe O P Sm       , 14.504,    0.709,
Br Fe La S      , 14.511,    0.709,
F Fe O P        , 14.526,     0.71,
Cl Fe N S       , 14.534,    0.711,
F Fe O S        ,  14.54,    0.711,
Fe Nd O S       , 14.552,    0.712,
Fe O P Pr       , 14.561,    0.713,
Fe O Pr S       , 14.575,    0.714,
Cl Cs Mo S      , 14.581,    0.714,
F Fe O Te       , 14.582,    0.714,
B Fe I O        , 14.598,    0.715,
Ce Fe O S       , 14.598,    0.715,
Ce Fe I S       , 14.603,    0.715,
Br Cs Nb S      , 14.607,    0.716,
F O Os Xe       ,  14.62,    0.717,
Cl Cs O Ru      , 14.625,    0.717,
I N N Rb        , 14.625,    0.717,
Cl Cs Dy S      ,  14.63,    0.717,
Cl Fe Li O      , 14.638,    0.718,
Br Cs S Tc      ,  14.64,    0.718,
Cl Cs Ho S      , 14.643,    0.718,
Fe La O P       , 14.652,    0.719,
Ca Fe O S       ,  14.66,    0.719,
Br Cl Cr Cs     , 14.663,    0.719,
Cs I Mo Se      , 14.663,     0.72,
Cl Cs F Sb      , 14.666,     0.72,
Ca Cl Fe O      , 14.667,     0.72,
Fe I La S       , 14.671,     0.72,
Cl Cs Dy Te     , 14.672,     0.72,
Cl Cs Ho Te     , 14.684,    0.721,
Cs O S V        , 14.708,    0.723,
C Fe O Se       , 14.709,    0.723,
Br Cs Mo S      , 14.716,    0.723,
C N O Rb        , 14.717,    0.723,
Br Cl Cs Mo     , 14.723,    0.724,
Am F K O        , 14.737,    0.725,
N O Rb W        , 14.737,    0.725,
F Fe O Ti       , 14.745,    0.725,
As Fe P Sr      , 14.745,    0.725,
As Ca F Fe      , 14.749,    0.725,
As Cs F O       , 14.758,    0.726,
Cl Cs Nb O      , 14.768,    0.727,
Cs F O Se       , 14.785,    0.728,
F Fe O Pb       , 14.805,    0.729,
Cl Cr Cs O      , 14.817,     0.73,
Fe N O S        , 14.823,     0.73,
F N O Xe        , 14.827,    0.731,
Cl Fe N O       ,  14.83,    0.731,
F O Re Xe       , 14.859,    0.733,
Cs Mo O S       , 14.869,    0.734,
Cl Cs Mo O      , 14.876,    0.734,
Cs S Se W       , 14.887,    0.735,
Bi F Fe O       , 14.891,    0.735,
Br Cs F Sn      , 14.908,    0.736,
C Fe O S        , 14.918,    0.737,
F Fe Nb O       , 14.928,    0.738,
F O W Xe        , 14.942,    0.738,
Br Cs Re Se     , 14.944,    0.739,
Cl Fe O W       , 14.945,    0.739,
Cs F O Sb       , 14.953,    0.739,
Br Fe N O       , 14.963,     0.74,
Cs F O P        ,  14.98,    0.741,
Fe O P Th       , 14.992,    0.742,
Cs F O S        , 14.994,    0.742,
Br Cs Mo O      , 15.009,    0.743,
Cl Cs Re S      , 15.019,    0.744,
Fe N O Ti       , 15.024,    0.744,
As Fe La N      , 15.034,    0.745,
Cs F O Te       , 15.035,    0.745,
Cl Cs O Os      , 15.075,    0.748,
Co F K O        , 15.076,    0.748,
Fe O Se Sr      , 15.078,    0.748,
Cl Cs F Nb      , 15.091,    0.749,
Cs I Re Se      , 15.099,    0.749,
Fe I N O        , 15.118,    0.751,
Br Cs Re S      ,  15.15,    0.753,
Br Cl Cs Re     , 15.157,    0.753,
Cs F O Ti       , 15.192,    0.756,
Br Cs F Nb      , 15.222,    0.758,
Br Cl Cs W      , 15.239,    0.759,
Fe O S Sr       , 15.283,    0.762,
Cs F I O        , 15.286,    0.762,
Cl Fe O Sr      , 15.289,    0.762,
Cs I Re S       , 15.304,    0.763,
Cl Cs O Re      , 15.306,    0.763,
Cs F O V        , 15.319,    0.764,
As Ba Fe P      , 15.347,    0.766,
Cl O Pu Rb      , 15.359,    0.767,
As F Fe Sr      , 15.368,    0.767,
Cs F Nb O       ,  15.37,    0.768,
Cr Cs F O       , 15.417,    0.771,
Br Fe O Sr      , 15.418,    0.771,
Cs F Mo O       , 15.474,    0.775,
Cs N Tb Te      , 15.564,    0.781,
Cs Gd N Te      ,  15.57,    0.781,
Ce Cs F O       , 15.648,    0.787,
Ba Br Fe S      ,  15.72,    0.791,
C Cs N Se       , 15.738,    0.793,
Cs Mo N O       ,  15.74,    0.793,
Cs F O Ta       , 15.824,    0.799,
Ba Fe O S       , 15.864,    0.801,
Ba Fe I S       , 15.868,    0.802,
Ba Cl Fe O      ,  15.87,    0.802,
F Fe O Sr       , 15.871,    0.802,
Cs F O Re       , 15.887,    0.803,
Cs N O Os       , 15.928,    0.806,
C Cs N S        , 15.934,    0.806,
C Cs F O        , 15.947,    0.807,
Cs F O W        , 15.965,    0.808,
Ba F Fe Se      , 15.971,    0.809,
Fe K S Se       , 15.992,     0.81,
Ba Br Fe O      , 15.995,     0.81,
Cl Cs O U       , 16.003,    0.811,
Cs I N N        , 16.122,    0.819,
Br Cs O U       , 16.126,    0.819,
Ba F Fe S       , 16.165,    0.822,
Cl Fe K S       , 16.191,    0.824,
C Cs N O        , 16.205,    0.825,
Cs N O W        , 16.223,    0.826,
Ba F Fe O       , 16.432,     0.84,
F K O Xe        , 16.455,    0.842,
Cl Cs Np O      ,  16.48,    0.843,
Cs F O U        ,  16.56,    0.849,
Cl Cs O Pu      ,  16.79,    0.864,
Cl O Rb Xe      , 16.989,    0.878,
F O Xe Xe       ,  17.92,    0.941,
Fe Fe S Te      , 18.214,    0.961,
Cl Cs O Xe      , 18.293,    0.967,
Cl Cs Fe Se     , 18.383,    0.973,
Cs Fe O S       , 18.779,      1.0,
Cs F O Xe       , 18.782,      1.0,
