Phase fields,     scores,     Norm. scores,
As As Cd Cl     ,  6.497,      0.0,
As Ge P Zn      ,  6.569,    0.005,
As Cd Ge P      ,  6.569,    0.005,
Cd Ge S Se      ,  6.587,    0.007,
As Ga Se Zn     ,  6.741,    0.018,
As Cd Ga Se     ,  6.741,    0.018,
Ge Sb Se Te     ,  6.769,    0.021,
As P Si Zn      ,  6.826,    0.025,
Cd S Se Si      ,  6.843,    0.026,
As Cd P Zn      ,  6.952,    0.034,
Cl Ga P Se      ,   6.96,    0.035,
Cd S Se Zn      ,   6.97,    0.036,
As Ga S Zn      ,  7.008,    0.038,
As Cd Ga S      ,  7.008,    0.038,
As In Se Zn     ,  7.022,     0.04,
As Cd In Se     ,  7.022,     0.04,
Cd Ga S Se      ,  7.048,    0.041,
Cl Ga Sb Se     ,  7.048,    0.042,
Ga P Se Zn      ,  7.071,    0.043,
Al Cl P Se      ,  7.135,    0.048,
Ge Se Sn Te     ,  7.149,    0.049,
Ni P S Se       ,  7.211,    0.054,
Al S Se Zn      ,  7.221,    0.054,
Al Cl Sb Se     ,  7.221,    0.054,
Cd Cl S Sb      ,  7.228,    0.055,
Cd Se Te Zn     ,  7.234,    0.056,
As Ga Te Zn     ,  7.271,    0.058,
As Cd Ga Te     ,  7.271,    0.058,
As Cd In S      ,  7.279,    0.059,
Cl Ga S Sb      ,  7.304,    0.061,
In S Se Zn      ,  7.318,    0.062,
Cd In S Se      ,  7.318,    0.062,
Ga P S Zn       ,  7.326,    0.062,
As Br Cd P      ,  7.333,    0.063,
As As Cd I      ,   7.34,    0.063,
Cl O Sb Se      ,  7.375,    0.066,
Br P S S        ,  7.425,     0.07,
As Cd Cl O      ,  7.426,     0.07,
Br Cd Sb Se     ,  7.455,    0.072,
Cl O Se Zn      ,  7.465,    0.073,
Cd Cl O Se      ,  7.465,    0.073,
O P P S         ,  7.472,    0.073,
In Sb Se Te     ,  7.483,    0.074,
Se Sn Te Zn     ,  7.503,    0.076,
Cd Se Sn Te     ,  7.504,    0.076,
S Se Sn Sn      ,  7.517,    0.077,
As Cd In Te     ,  7.533,    0.078,
As Cu Ge Se     ,  7.555,     0.08,
Cl Ga Sb Te     ,  7.557,     0.08,
Cl In S Sb      ,  7.565,     0.08,
I S Sb Se       ,  7.574,    0.081,
In S Se Sn      ,  7.584,    0.082,
Br Cl S Sb      ,  7.595,    0.083,
Br Cd P P       ,  7.638,    0.086,
Cl O P Sb       ,  7.642,    0.086,
As Cd I P       ,  7.645,    0.086,
Al Br Sb Se     ,   7.69,     0.09,
Br Cd S Sb      ,  7.697,     0.09,
As Cl F Se      ,  7.704,    0.091,
In Ni S Se      ,  7.716,    0.092,
In S Sb Te      ,  7.724,    0.092,
Cl O Se Sn      ,  7.726,    0.092,
Cd Cl O P       ,  7.728,    0.093,
S Sn Te Zn      ,  7.744,    0.094,
Cd S Sn Te      ,  7.744,    0.094,
As Cl In O      ,  7.754,    0.095,
Br In Sb Se     ,  7.782,    0.097,
Cl In O Se      ,  7.791,    0.097,
Cl O Sb Zn      ,  7.807,    0.099,
Cd Cl O Sb      ,  7.807,    0.099,
Cu Ge P Se      ,  7.852,    0.102,
As F S S        ,  7.854,    0.102,
Cl Ni O Se      ,  7.855,    0.102,
Cl O Sb Te      ,  7.863,    0.103,
As Br Cd O      ,  7.884,    0.104,
Cd I P S        ,  7.917,    0.107,
Al Cl O S       ,  7.934,    0.108,
Ag S Sb Se      ,  7.936,    0.108,
As Cl F S       ,  7.938,    0.108,
Cl O Te Zn      ,  7.947,    0.109,
Cd Cl O Te      ,  7.947,    0.109,
Cl O S Sn       ,   7.96,     0.11,
Cl Mg O P       ,   7.96,     0.11,
Cl In In S      ,  7.971,    0.111,
Cl O P Sn       ,   7.98,    0.112,
Cd I S Sb       ,  7.995,    0.113,
Cu P S Se       ,  7.997,    0.113,
Ag Cl Ge S      ,  8.007,    0.114,
I Sb Se Sn      ,  8.013,    0.114,
Br In S Sb      ,  8.014,    0.114,
As Cl Cu S      ,  8.024,    0.115,
Al Cd O S       ,  8.032,    0.116,
Cl Cl O Sn      ,  8.043,    0.116,
Ag S Se Te      ,  8.074,    0.119,
Cu S Sb Se      ,  8.074,    0.119,
Cl Cu P Se      ,   8.08,    0.119,
Cu Ge P S       ,  8.082,    0.119,
Ag Ga S Se      ,  8.088,     0.12,
As Br F Se      ,  8.145,    0.124,
Ag Cl Se Te     ,  8.155,    0.125,
Br Cd O P       ,  8.168,    0.126,
Ag Sb Se Te     ,   8.17,    0.126,
Ag Cl P S       ,   8.17,    0.126,
As Cl F Te      ,  8.172,    0.126,
Br In In Se     ,  8.177,    0.126,
I P P Sn        ,  8.184,    0.127,
As Br In O      ,  8.193,    0.128,
As Cu In Se     ,  8.201,    0.128,
Ga S Se V       ,  8.206,    0.129,
Cu Ga S Se      ,  8.223,     0.13,
I S Sb Sn       ,  8.239,    0.131,
Cl In O Te      ,  8.254,    0.132,
Al Cd O Te      ,  8.263,    0.133,
Cl P S Ti       ,  8.284,    0.134,
Br Ni O Se      ,  8.288,    0.135,
Cl Cu P S       ,  8.304,    0.136,
Cl Ni O Te      ,  8.314,    0.137,
Cl F P Sb       ,  8.315,    0.137,
Ag Ga Se Te     ,  8.317,    0.137,
Ag In S Se      ,  8.324,    0.137,
Al Cl O Sn      ,  8.355,     0.14,
As Br F S       ,  8.368,    0.141,
Al Cu S Se      ,  8.371,    0.141,
Br O Te Zn      ,  8.376,    0.141,
Ag Cl S Te      ,  8.377,    0.142,
Cl F Sb Sb      ,  8.389,    0.142,
As F O S        ,   8.39,    0.142,
Ag O P Se       ,  8.394,    0.143,
Ag Cl In Se     ,  8.403,    0.143,
Br Cl I Sb      ,  8.408,    0.144,
F O S Se        ,  8.424,    0.145,
As F I Se       ,  8.427,    0.145,
Ag Br Ge S      ,  8.433,    0.146,
Ga Ga I Te      ,  8.438,    0.146,
Al I Sb Te      ,  8.441,    0.146,
Cu Ga Se Te     ,  8.448,    0.147,
As Br Cu S      ,  8.449,    0.147,
Cu In S Se      ,  8.455,    0.147,
Cl N S Se       ,  8.457,    0.147,
As Cl F O       ,  8.469,    0.148,
Ge Pb S Se      ,  8.472,    0.149,
Ag Ge I Se      ,  8.492,     0.15,
Br F Sb Se      ,  8.494,     0.15,
Br Cu P Se      ,  8.502,    0.151,
As Cl Hg S      ,  8.502,    0.151,
Cl Cu S Te      ,  8.508,    0.151,
Cd Cl I O       ,  8.508,    0.151,
As Hg S Sb      ,  8.516,    0.152,
Cl F Sb Te      ,  8.519,    0.152,
Ag S Te Te      ,  8.521,    0.152,
Ag In Se Te     ,  8.547,    0.154,
Cl N Sb Se      ,  8.548,    0.154,
As Cl Cu O      ,  8.549,    0.154,
As Cd F O       ,   8.56,    0.155,
Br Cu Ge S      ,  8.563,    0.155,
B O Se Zn       ,  8.564,    0.156,
N P Se Zn       ,  8.567,    0.156,
Ag Br Se Te     ,  8.574,    0.156,
Cl F Ge O       ,  8.582,    0.157,
Cl Cu O Se      ,  8.582,    0.157,
As Br F Te      ,  8.589,    0.157,
B Br P S        ,  8.607,    0.159,
Cl Mn S Sb      ,  8.608,    0.159,
O S Se Zr       ,  8.613,    0.159,
Cd Mn Se Te     ,  8.613,    0.159,
Ag Cl In S      ,  8.619,     0.16,
Cu Ge I Se      ,  8.621,     0.16,
As Cu In Te     ,  8.642,    0.161,
As F I S        ,  8.642,    0.161,
Ag O S Si       ,  8.657,    0.163,
As As Br Hg     ,  8.663,    0.163,
Br In O Te      ,  8.668,    0.163,
Cl N S S        ,  8.671,    0.164,
Cu In Se Te     ,  8.675,    0.164,
F O P P         ,  8.677,    0.164,
Br S S V        ,   8.68,    0.164,
In Mn S Se      ,  8.683,    0.164,
Cl Ga N Se      ,  8.689,    0.165,
Ge Pb Se Te     ,  8.691,    0.165,
As Br Hg Se     ,  8.696,    0.165,
Ag S Sn Te      ,  8.701,    0.166,
Ag Ge I S       ,  8.706,    0.166,
Br F S Sb       ,  8.707,    0.166,
Br Cu P S       ,  8.715,    0.167,
Cl F O S        ,  8.715,    0.167,
As Cu I S       ,  8.721,    0.167,
Br Ni O Te      ,  8.725,    0.168,
Al Al I Te      ,  8.725,    0.168,
F O S Sb        ,  8.729,    0.168,
Ag Cl O Si      ,  8.733,    0.168,
As Cl Ga Hg     ,  8.734,    0.168,
Cl F O P        ,  8.734,    0.168,
F O P Sb        ,  8.748,    0.169,
Hg O Se Se      ,   8.75,     0.17,
Cl N S Sb       ,  8.761,     0.17,
Br Cu S Si      ,  8.762,     0.17,
Bi S Sb Se      ,  8.762,     0.17,
F I Sb Se       ,  8.764,    0.171,
Cu I P Se       ,  8.772,    0.171,
Cd Pb S Se      ,  8.773,    0.171,
Cl O S Ti       ,  8.775,    0.171,
N P S Zn        ,  8.779,    0.172,
Cd N P S        ,  8.779,    0.172,
Cl O P Ti       ,  8.793,    0.173,
Br Mn Sb Se     ,  8.799,    0.173,
Cl F O Sb       ,  8.805,    0.174,
Ag O S Te       ,  8.807,    0.174,
Ag Br In Se     ,   8.81,    0.174,
Cu I Se Si      ,  8.819,    0.175,
Pb S Se Te      ,  8.822,    0.175,
F O P Zn        ,  8.823,    0.175,
Cd F O P        ,  8.823,    0.175,
Ag O P Te       ,  8.825,    0.175,
Ca O P Se       ,  8.827,    0.175,
As Cd Cr Se     ,  8.827,    0.175,
Cu Ge I S       ,  8.831,    0.176,
Ag Cl In Te     ,  8.834,    0.176,
Cd Hg Se Te     ,  8.842,    0.176,
B Cl O Zn       ,  8.851,    0.177,
As Ca Cl O      ,  8.852,    0.177,
F O S Te        ,  8.854,    0.177,
Cl N P Zn       ,  8.854,    0.177,
As F I Te       ,  8.857,    0.178,
Ag Br Cl Te     ,  8.861,    0.178,
As Br F O       ,  8.872,    0.179,
B I P S         ,  8.874,    0.179,
Al F Ge O       ,  8.876,    0.179,
Dy O Se Si      ,  8.878,    0.179,
F Ge Mg O       ,  8.881,    0.179,
Ag Cl O Te      ,  8.882,    0.179,
Cl Cu O Sb      ,  8.882,    0.179,
N O S Se        ,  8.882,    0.179,
I In In Te      ,  8.886,     0.18,
Ho O Se Si      ,  8.887,     0.18,
Bi S Se Te      ,  8.887,     0.18,
Cl Dy O Se      ,  8.889,     0.18,
Cd F O Sb       ,  8.893,     0.18,
Er O Se Si      ,  8.894,     0.18,
As Cl Hg Sn     ,  8.896,    0.181,
Cl Ho O Se      ,  8.897,    0.181,
Cl Ga N S       ,  8.898,    0.181,
Cl O S Zr       ,  8.898,    0.181,
Ge Pb S Te      ,    8.9,    0.181,
As Br Hg S      ,  8.904,    0.181,
Cl Er O Se      ,  8.905,    0.181,
Br Cu S Te      ,   8.91,    0.182,
Cl Hg S Zn      ,  8.911,    0.182,
S Sb Se Tl      ,  8.912,    0.182,
Cl Ga N P       ,  8.916,    0.182,
Ag I S Sb       ,  8.925,    0.183,
Br Cu In Se     ,  8.934,    0.183,
Cd Cl O V       ,  8.941,    0.184,
Dy S Te Te      ,  8.954,    0.185,
Cl Cu In Te     ,  8.958,    0.185,
Br C Se Se      ,  8.959,    0.185,
Ag Br S Sn      ,  8.959,    0.185,
As Hg I Se      ,   8.96,    0.185,
Ca Cl Ge O      ,  8.961,    0.185,
Ho S Te Te      ,  8.962,    0.186,
O Se Si Tb      ,  8.969,    0.186,
F I S Sb        ,  8.971,    0.186,
Bi Cl Ga Se     ,  8.974,    0.186,
Bi Sb Se Te     ,  8.975,    0.186,
Cu I P S        ,  8.979,    0.187,
Cl O Se Tb      ,  8.979,    0.187,
Cl Pb S Sb      ,   8.98,    0.187,
B Mg O S        ,  8.981,    0.187,
Mg N P S        ,  8.984,    0.187,
Cd Pb Se Te     ,  8.985,    0.187,
Cl O Se Tm      ,   8.99,    0.188,
Cl O Te V       ,   8.99,    0.188,
N P Te Zn       ,  8.991,    0.188,
Pb S Se Sn      ,  8.996,    0.188,
Ag Br Te Te     ,  8.997,    0.188,
As Cl Hg O      ,    9.0,    0.188,
Br Mn S Sb      ,  9.005,    0.189,
Cl Cu O Te      ,  9.005,    0.189,
Ag Br In S      ,  9.016,     0.19,
Ge N O Si       ,  9.022,     0.19,
Al F O P        ,  9.023,     0.19,
Cu I S Si       ,  9.024,     0.19,
F O S Sn        ,  9.027,     0.19,
F Mg O P        ,  9.027,     0.19,
Cl Mn O P       ,  9.031,    0.191,
Ag Al Cl O      ,  9.032,    0.191,
Ca O P S        ,  9.033,    0.191,
Al Cl N S       ,  9.035,    0.191,
F O P Sn        ,  9.045,    0.192,
Cl F I Sb       ,  9.045,    0.192,
Ga S Se Tl      ,  9.047,    0.192,
Cu I S Sb       ,  9.047,    0.192,
Al Cl N P       ,  9.053,    0.192,
B Cl Mg O       ,  9.055,    0.192,
Cl Nb P Se      ,   9.06,    0.193,
I Mn Sb Se      ,   9.06,    0.193,
Cr S Se Zn      ,  9.064,    0.193,
Cd Cr S Se      ,  9.064,    0.193,
As Br Cd Hg     ,  9.065,    0.193,
Al F O Si       ,  9.068,    0.193,
Ag I In Se      ,  9.071,    0.194,
F Mg O Si       ,  9.072,    0.194,
Cl Mo S Se      ,  9.076,    0.194,
F Ga O Te       ,  9.076,    0.194,
Ca O S Si       ,  9.078,    0.194,
Dy O S Si       ,  9.083,    0.195,
Ag As I O       ,  9.086,    0.195,
N O S S         ,  9.086,    0.195,
Ca Cl O S       ,  9.088,    0.195,
Ho O S Si       ,  9.091,    0.195,
Br Hg Se Zn     ,  9.096,    0.196,
Er O S Si       ,  9.098,    0.196,
Ca O S Sb       ,  9.101,    0.196,
Ca Cl O P       ,  9.106,    0.196,
Cl O Te Zr      ,  9.107,    0.196,
Al Bi Cl Se     ,   9.11,    0.197,
Bi Cd Cl S      ,  9.116,    0.197,
Ag I O Se       ,  9.117,    0.197,
Ge N O Zn       ,  9.118,    0.197,
Cd Ge N O       ,  9.119,    0.197,
As Bi Ni S      ,  9.139,    0.199,
As Cl O Pb      ,   9.14,    0.199,
Cl Hg P Sn      ,  9.149,      0.2,
Ca Cl O Si      ,  9.151,      0.2,
Cl Dy O Si      ,  9.155,      0.2,
La S S Se       ,  9.159,      0.2,
Cl N O S        ,  9.159,      0.2,
As Hg I S       ,  9.163,    0.201,
Br O S Ti       ,  9.165,    0.201,
Cu I S Te       ,  9.168,    0.201,
Ca O S Zn       ,  9.173,    0.201,
Cu S Se V       ,  9.175,    0.201,
Cl N O P        ,  9.177,    0.202,
F I Sb Te       ,  9.179,    0.202,
O S Si Tm       ,  9.181,    0.202,
B Cl Ni O       ,  9.182,    0.202,
Cl Hg In S      ,  9.187,    0.202,
Cu I In Se      ,  9.192,    0.203,
Br F O Sb       ,  9.193,    0.203,
Dy O P Zn       ,  9.196,    0.203,
As As Re S      ,  9.198,    0.203,
Pb Se Sn Te     ,  9.203,    0.204,
Cl Hg In P      ,  9.204,    0.204,
Br Cl Hg S      ,  9.212,    0.204,
Al Br N Se      ,  9.218,    0.205,
Ga Mo S Se      ,  9.222,    0.205,
Ag Br In Te     ,  9.222,    0.205,
F Ni O Sb       ,  9.223,    0.205,
Br Nb Se Se     ,  9.224,    0.205,
F Ga Mg O       ,  9.228,    0.205,
Cl Cu In O      ,   9.23,    0.206,
O Se Se Sm      ,   9.23,    0.206,
Bi Cl O Se      ,  9.233,    0.206,
B Br O Zn       ,  9.238,    0.206,
As F N Se       ,  9.241,    0.206,
Cl O Si Tb      ,  9.243,    0.207,
Cl N O Sb       ,  9.244,    0.207,
Cl Ge O Pb      ,  9.245,    0.207,
Cl Hg O P       ,   9.25,    0.207,
Cl Nb P S       ,  9.261,    0.208,
N O P Zn        ,  9.262,    0.208,
Br Cu O Sb      ,  9.268,    0.208,
Cr Se Te Zn     ,   9.27,    0.209,
Cd Cr Se Te     ,   9.27,    0.209,
Cl Mo S S       ,  9.276,    0.209,
As Br Hg Sn     ,  9.281,    0.209,
F In O Te       ,  9.287,     0.21,
Cl S Si Sm      ,   9.29,     0.21,
Br Cd Hg S      ,  9.296,    0.211,
Ag Br I S       ,  9.296,    0.211,
Bi Br Cd Se     ,  9.297,    0.211,
O Pb S S        ,  9.298,    0.211,
Cl Ho O Te      ,  9.306,    0.211,
Bi Ga S Te      ,  9.308,    0.212,
Al Bi Cl S      ,   9.31,    0.212,
Br F O Te       ,  9.312,    0.212,
As Cd Hg I      ,  9.319,    0.212,
Bi In Se Te     ,  9.319,    0.212,
Br Cd O V       ,  9.324,    0.213,
B Br I P        ,  9.331,    0.213,
Cl Re Se Se     ,  9.331,    0.213,
Ag I O P        ,  9.334,    0.213,
As Br Hg In     ,  9.336,    0.214,
Br Cu In Te     ,  9.341,    0.214,
Cu Rh S Se      ,  9.355,    0.215,
Se Te Ti Ti     ,  9.357,    0.215,
Bi O S S        ,  9.359,    0.215,
Eu O Se Se      ,  9.365,    0.216,
Al Ca O S       ,  9.366,    0.216,
Cl O Pb S       ,  9.369,    0.216,
Cu Se Te V      ,  9.377,    0.217,
Bi Cl Ga Te     ,  9.379,    0.217,
As Br Hg O      ,   9.38,    0.217,
O Pb S Sb       ,  9.381,    0.217,
Bi Cl In S      ,  9.385,    0.217,
Br Cu O Te      ,  9.386,    0.217,
Cl O P Pb       ,  9.386,    0.217,
As Cu Mn P      ,  9.387,    0.217,
Dy O S Sn       ,  9.392,    0.218,
Al Cl Nb Se     ,  9.392,    0.218,
Cl O Se Y       ,  9.396,    0.218,
Cl O Se Yb      ,  9.398,    0.218,
Pb S Sn Te      ,    9.4,    0.218,
I S Si Tb       ,  9.402,    0.219,
Bi Br Cl S      ,   9.41,    0.219,
Ga Mo Se Te     ,  9.423,     0.22,
La O Se Se      ,  9.429,    0.221,
In Mo S Se      ,  9.429,    0.221,
Cl O Pb Si      ,   9.43,    0.221,
Al Ca Cl O      ,  9.436,    0.221,
As F N S        ,  9.438,    0.221,
F I O Sb        ,  9.444,    0.222,
As O Y Zn       ,  9.448,    0.222,
Cl O Pb Sb      ,  9.452,    0.222,
Ag S Te V       ,  9.455,    0.223,
Ga N O Zn       ,  9.457,    0.223,
Cl Hg I S       ,  9.462,    0.223,
As Cl O Sm      ,  9.467,    0.223,
As Cu Ho P      ,  9.472,    0.224,
Ag I In Te      ,  9.472,    0.224,
Br Mn O Sb      ,  9.476,    0.224,
As Cu Er P      ,  9.479,    0.224,
Mo Ni S Se      ,  9.482,    0.225,
Br Ca O P       ,  9.483,    0.225,
Br O Te Zr      ,  9.484,    0.225,
O Se Si Sm      ,  9.487,    0.225,
Cl La S Si      ,  9.488,    0.225,
Bi Br Cd S      ,  9.492,    0.225,
Al N O Si       ,  9.495,    0.226,
Ag Br I Te      ,  9.496,    0.226,
Cl O Se Sm      ,  9.497,    0.226,
O S S Tl        ,    9.5,    0.226,
Al Cl N O       ,  9.505,    0.226,
Br Hg S Sn      ,  9.507,    0.226,
Al Bi Cl Te     ,  9.509,    0.227,
Bi In S Te      ,  9.514,    0.227,
As Br O Pb      ,  9.515,    0.227,
Ag I O Te       ,  9.516,    0.227,
Cd Cl O Pb      ,  9.522,    0.228,
Br Hg P Sn      ,  9.524,    0.228,
Au Cl P S       ,  9.525,    0.228,
Br Ca O Si      ,  9.526,    0.228,
Cl N O Sn       ,  9.526,    0.228,
As Hg I Sn      ,  9.529,    0.228,
C Cl O Sb       ,  9.532,    0.228,
Cl Li P S       ,  9.534,    0.228,
Ag As Cl Hg     ,  9.535,    0.229,
Cl Mo O Se      ,  9.544,    0.229,
Hg I S Zn       ,  9.544,    0.229,
Bi Cd I Se      ,  9.545,    0.229,
Br O Pb Se      ,  9.545,    0.229,
B Br Ni O       ,  9.556,     0.23,
F I O Te        ,   9.56,     0.23,
Bi Br In Se     ,  9.561,    0.231,
Cl F P Rh       ,  9.564,    0.231,
Al Ca O Te      ,  9.564,    0.231,
Bi Ni S Te      ,  9.566,    0.231,
Cl O Pb Te      ,  9.568,    0.231,
Cd I O V        ,  9.571,    0.231,
O S Si Y        ,  9.579,    0.232,
O S Si Yb       ,  9.581,    0.232,
Bi Cd Cl O      ,  9.582,    0.232,
Cu Cu S Te      ,  9.586,    0.232,
Cu I In Te      ,  9.588,    0.233,
As La O S       ,  9.592,    0.233,
As Cl Eu O      ,  9.598,    0.233,
Bi Br O Se      ,  9.605,    0.234,
I Pb S Sb       ,  9.608,    0.234,
F O S Tc        ,  9.608,    0.234,
Br Cl Cr S      ,  9.623,    0.235,
Bi Cl O Te      ,  9.627,    0.236,
Cl Eu O Se      ,  9.628,    0.236,
C F Ge Se       ,  9.631,    0.236,
As Cl Hg Ti     ,  9.632,    0.236,
F Ge O V        ,  9.637,    0.236,
Cl P Se Ta      ,  9.647,    0.237,
Cl O Si Y       ,  9.648,    0.237,
Cl O Si Yb      ,   9.65,    0.237,
Ag F O S        ,  9.657,    0.238,
Br S Si Sm      ,  9.659,    0.238,
As Br Li S      ,   9.66,    0.238,
As Cl La O      ,  9.661,    0.238,
Ag F O P        ,  9.674,    0.239,
F N P S         ,  9.677,    0.239,
O S Si Sm       ,  9.679,    0.239,
Cl Cu Hg Se     ,  9.679,    0.239,
La O Se Si      ,  9.681,     0.24,
O P Y Zn        ,  9.687,     0.24,
Ag Bi S Se      ,  9.687,     0.24,
F O Sb Tc       ,  9.689,     0.24,
Br Re Se Se     ,  9.699,    0.241,
Cl Cr O Si      ,  9.702,    0.241,
Ga O S Tl       ,  9.707,    0.242,
As I Li Se      ,  9.712,    0.242,
B Cl N P        ,  9.719,    0.242,
Cl Nb O P       ,  9.719,    0.242,
I Mn O Sb       ,  9.719,    0.242,
As C F S        ,  9.721,    0.243,
Ca I O P        ,  9.726,    0.243,
Cl Mo O S       ,  9.734,    0.244,
Cl S Se W       ,  9.739,    0.244,
F N S Sb        ,   9.74,    0.244,
As La O Zn      ,  9.742,    0.244,
B Cl F O        ,  9.742,    0.244,
As Cl Hg Zr     ,  9.745,    0.244,
Cl F N P        ,  9.745,    0.244,
Cl O Si Sm      ,  9.747,    0.245,
Cl Mo O P       ,  9.751,    0.245,
Br O P Pb       ,  9.752,    0.245,
Ag Bi Cl Se     ,  9.755,    0.245,
As I O Pb       ,  9.757,    0.245,
Au Cl O Se      ,  9.769,    0.246,
La O Se Zn      ,  9.771,    0.246,
F O P V         ,  9.773,    0.246,
Cl Hg Se Zr     ,  9.774,    0.247,
Cl N S V        ,  9.784,    0.247,
O P Sm Zn       ,  9.785,    0.247,
I O Pb Se       ,  9.787,    0.248,
Cu F O P        ,  9.787,    0.248,
F Hg S Si       ,  9.788,    0.248,
As Cr Cu Se     ,  9.791,    0.248,
Br O Pb Si      ,  9.794,    0.248,
B I Ni O        ,  9.797,    0.248,
Cl N P Ti       ,  9.798,    0.248,
Cl Cu N S       ,  9.798,    0.248,
Bi I In Se      ,  9.802,    0.249,
Br Cl O Pb      ,  9.803,    0.249,
As Ni P Sr      ,  9.806,    0.249,
Nd O Se Se      ,  9.807,    0.249,
Br O Pb Sb      ,  9.815,     0.25,
C Cl F Se       ,  9.818,     0.25,
C F Ge S        ,   9.82,     0.25,
B Cd F O        ,  9.822,     0.25,
As Ca F O       ,  9.822,     0.25,
Br Hg I S       ,  9.825,     0.25,
Ga La O Se      ,  9.827,    0.251,
Cl Eu O P       ,  9.833,    0.251,
Cl P S Ta       ,  9.835,    0.251,
Cl Cr O Te      ,  9.836,    0.251,
Cl N Si Ti      ,   9.84,    0.252,
As Cl O Sr      ,  9.849,    0.252,
Br La S Si      ,   9.85,    0.252,
Cl Cl N V       ,  9.852,    0.252,
Dy F O Se       ,  9.856,    0.253,
I Nb Se Te      ,  9.859,    0.253,
Bi Br Cl O      ,  9.862,    0.253,
Cl Nd S Si      ,  9.863,    0.253,
F Ho O Se       ,  9.864,    0.253,
Cl N Sb V       ,  9.864,    0.253,
B F O Te        ,  9.866,    0.253,
Cl Hg P Ti      ,  9.866,    0.254,
Cl Cu Hg S      ,  9.867,    0.254,
Bi Cl Cu Se     ,  9.868,    0.254,
La O S Si       ,  9.869,    0.254,
Er F O Se       ,   9.87,    0.254,
Br La S Sb      ,  9.871,    0.254,
O Si Sm Te      ,  9.871,    0.254,
Cl Eu O Si      ,  9.875,    0.254,
Ag N O Se       ,  9.875,    0.254,
Cl O Se Sr      ,  9.878,    0.254,
Cl La O S       ,  9.878,    0.254,
Ag Bi Se Te     ,  9.879,    0.254,
As F N O        ,  9.888,    0.255,
O Sb Se Sr      ,   9.89,    0.255,
La O S Sb       ,   9.89,    0.255,
Cl Cu O V       ,  9.893,    0.256,
Br Li P S       ,  9.894,    0.256,
Cl Nb O Te      ,  9.894,    0.256,
Cl La O P       ,  9.895,    0.256,
F O Sc Se       ,  9.895,    0.256,
I S Si Sm       ,  9.898,    0.256,
As I Li S       ,  9.899,    0.256,
Cl N P Zr       ,  9.909,    0.257,
As Ga Mn N      ,  9.916,    0.257,
S Se Tl V       ,   9.92,    0.258,
Ca F Ge O       ,  9.921,    0.258,
Cu Dy O Se      ,  9.925,    0.258,
Cl Mo O Te      ,  9.925,    0.258,
Cl S S W        ,  9.926,    0.258,
Br O Pb Te      ,  9.927,    0.258,
Cl La O Si      ,  9.936,    0.259,
F O Se Tb       ,  9.937,    0.259,
Bi Br Cd O      ,   9.94,    0.259,
Ag Bi Cl S      ,  9.942,    0.259,
Be Cl I Zr      ,  9.944,    0.259,
F O Te Ti       ,  9.944,    0.259,
As Cl Pr S      ,  9.945,    0.259,
F O Se Tm       ,  9.947,     0.26,
F O Te V        ,  9.947,     0.26,
Ga Se Ta Te     ,  9.957,     0.26,
Cl Hg S Zr      ,   9.96,    0.261,
Cu F O Te       ,  9.961,    0.261,
C N Se Se       ,  9.966,    0.261,
Cl Lu O Se      ,  9.971,    0.261,
La O P Zn       ,  9.973,    0.262,
Cl Hg P Zr      ,  9.976,    0.262,
Cl Li O P       ,   9.98,    0.262,
Ag Mo S Se      ,  9.983,    0.262,
Bi Br O Te      ,  9.984,    0.262,
F Mn O P        ,  9.984,    0.262,
I O P Pb        ,  9.989,    0.263,
As Br Hg Ti     ,  9.989,    0.263,
Na O S S        ,  9.991,    0.263,
Al B F O        , 10.001,    0.264,
Cr Cu S Se      , 10.005,    0.264,
As Br Cu Hg     , 10.006,    0.264,
B F Mg O        , 10.006,    0.264,
Na O P S        , 10.008,    0.264,
Ca Pb S Se      , 10.008,    0.264,
B Cl Mn O       , 10.009,    0.264,
Ga La O S       , 10.012,    0.264,
O P S Sr        , 10.012,    0.264,
Br Hg I Te      , 10.014,    0.265,
Br Cr O P       , 10.015,    0.265,
As Br La O      , 10.017,    0.265,
F Mn O Si       , 10.025,    0.265,
Br Mo Te Te     , 10.029,    0.266,
As Cl Nd O      ,  10.03,    0.266,
F I I O         , 10.031,    0.266,
B Cl Mg N       , 10.033,    0.266,
Br Cu Hg Se     , 10.034,    0.266,
I Se Se Ta      , 10.036,    0.266,
Cl I O Pb       , 10.039,    0.266,
Dy F O S        ,  10.04,    0.267,
As La Ni O      , 10.044,    0.267,
F Ho O S        , 10.048,    0.267,
Nd O Se Si      ,  10.05,    0.267,
Ag Cl Mo Se     ,  10.05,    0.267,
I O Pb Sb       ,  10.05,    0.267,
As Cl Hg Hg     , 10.051,    0.267,
Bi Cl Cu S      , 10.052,    0.267,
Ca F O P        , 10.052,    0.268,
Er F O S        , 10.055,    0.268,
Br Cr O Si      , 10.056,    0.268,
Cl Hf O S       , 10.058,    0.268,
Cl Nd O Se      , 10.059,    0.268,
Ag N O S        , 10.059,    0.268,
C Cl F Si       ,  10.06,    0.268,
Cu Nb S Se      , 10.063,    0.268,
B Ca Cl O       , 10.077,    0.269,
Cl O P Sr       , 10.078,    0.269,
B Cl Dy O       , 10.081,     0.27,
F Mg O Ti       , 10.083,     0.27,
I La S Si       , 10.084,     0.27,
B Cl Ho O       , 10.089,     0.27,
Ca F O Si       , 10.093,    0.271,
Cu Mo S Se      , 10.093,    0.271,
B Cl Er O       , 10.095,    0.271,
Cl Re Te Te     , 10.097,    0.271,
Dy F O Si       , 10.097,    0.271,
Br F N P        , 10.098,    0.271,
Cl In Nb O      ,   10.1,    0.271,
F Ho O Si       , 10.105,    0.271,
Ag Br Hg S      , 10.107,    0.272,
Ag Bi Br Se     , 10.108,    0.272,
As Nd O Zn      , 10.108,    0.272,
As In Mn N      ,  10.11,    0.272,
Er F O Si       , 10.111,    0.272,
Ca F O Sb       , 10.113,    0.272,
Cl F Ir P       , 10.118,    0.272,
Cl O Si Sr      , 10.119,    0.272,
B Cl I Zr       ,  10.12,    0.273,
F O S Tb        ,  10.12,    0.273,
Ag Cl N O       , 10.125,    0.273,
Br Hg Se Zr     , 10.126,    0.273,
I Li P S        , 10.127,    0.273,
Br N S V        , 10.136,    0.274,
C N S Se        , 10.148,    0.275,
La O S Sn       , 10.154,    0.275,
Cl O Re S       , 10.155,    0.275,
Ca Cl O V       , 10.156,    0.275,
Cl Dy O Ti      , 10.157,    0.275,
O Pr Se Se      , 10.158,    0.275,
B Cl O Tb       , 10.161,    0.276,
B Br Cu O       , 10.162,    0.276,
C N P Se        , 10.164,    0.276,
Cl F N O        , 10.166,    0.276,
Br S S Ta       , 10.169,    0.276,
Ca Cl Cu O      , 10.169,    0.276,
B Cl O Tm       ,  10.17,    0.276,
Cl O P Re       , 10.171,    0.276,
O S Tb Ti       , 10.172,    0.276,
Bi Cd I O       , 10.172,    0.277,
F Hg Ni S       , 10.174,    0.277,
F N O Sb        , 10.177,    0.277,
F Hg O P        , 10.183,    0.277,
As Cr Mn P      , 10.186,    0.278,
I Li S Sb       , 10.188,    0.278,
C Cl F Te       , 10.189,    0.278,
F Mg O Zr       ,  10.19,    0.278,
Cl F O Ru       , 10.191,    0.278,
Cr Cu Se Te     , 10.191,    0.278,
As Br Na O      , 10.194,    0.278,
Cr Mn S Se      , 10.198,    0.278,
Ni Se Ta Te     , 10.199,    0.279,
Ag Au S Se      , 10.199,    0.279,
In La O S       , 10.204,    0.279,
Br Nd S Si      , 10.212,     0.28,
Cl Pr S Si      , 10.212,     0.28,
Br Cu Hg S      , 10.215,     0.28,
Bi I O Te       , 10.215,     0.28,
Bi Br Cu Se     , 10.216,     0.28,
Cl N O Ti       , 10.217,     0.28,
Cl N O V        , 10.219,     0.28,
I Nb Te Te      , 10.229,    0.281,
Nd O S Si       , 10.231,    0.281,
As Bi Cl Hg     , 10.233,    0.281,
Cl Cu N O       , 10.233,    0.281,
Bi Cu O Se      , 10.235,    0.281,
Br C F Ge       , 10.235,    0.281,
Cl Nd O S       ,  10.24,    0.282,
Br Nb O Te      , 10.242,    0.282,
Ag N O Te       , 10.244,    0.282,
Bi Cl Mn S      , 10.244,    0.282,
Cr I O P        , 10.246,    0.282,
Cl O Sr Te      , 10.247,    0.282,
Cu Nb Se Te     , 10.248,    0.282,
Cl O S Ta       , 10.252,    0.283,
Cl Nd O P       , 10.256,    0.283,
I Mo Te Te      , 10.259,    0.283,
F O Sc Te       , 10.264,    0.283,
La Ni O P       , 10.269,    0.284,
