Br Ca I N       ,   5.27,    0.482,
As O Rb Sn      ,  5.273,    0.482,
Bi F O V        ,  5.275,    0.483,
B Cl O Pb       ,  5.275,    0.483,
Ba F Ga O       ,  5.276,    0.483,
Ba Cl O Sb      ,  5.278,    0.483,
Bi F Nb O       ,  5.279,    0.483,
Ce Cl O Ta      ,  5.282,    0.484,
B Dy F O        ,  5.285,    0.484,
Br Gd O W       ,  5.286,    0.484,
I Pt Ta Te      ,  5.287,    0.484,
Cl F O Pb       ,  5.291,    0.485,
Ag C F O        ,  5.294,    0.485,
Cl N P Ta       ,  5.294,    0.485,
Cl F Sm Sr      ,  5.294,    0.486,
B Br K O        ,  5.294,    0.486,
Cl O Pr Ta      ,  5.295,    0.486,
B Ba Cl F       ,  5.297,    0.486,
As Au O Sm      ,  5.298,    0.486,
B Ba Br O       ,  5.298,    0.486,
Cl K Re Se      ,  5.302,    0.487,
Cl N Re S       ,  5.302,    0.487,
Cl O Pr W       ,  5.303,    0.487,
Mo O Rb S       ,  5.305,    0.487,
Cl N S W        ,  5.308,    0.488,
Bi Br O Y       ,   5.31,    0.488,
B Ba O P        ,  5.311,    0.488,
Cl N Si W       ,  5.313,    0.488,
Bi I O Te       ,  5.313,    0.488,
Cl N Na Ti      ,  5.314,    0.489,
Br O Tb W       ,  5.315,    0.489,
Ba Cl O Te      ,  5.316,    0.489,
Cl Gd La O      ,  5.318,    0.489,
Cl Nd O Ta      ,  5.321,     0.49,
F K O P         ,  5.323,     0.49,
Br F Na Pb      ,  5.324,     0.49,
Ba F Mn O       ,  5.325,     0.49,
B F Ho O        ,  5.325,     0.49,
Co F K O        ,  5.326,     0.49,
Ba F O P        ,  5.327,     0.49,
Ba Co F O       ,   5.33,    0.491,
F K O S         ,   5.33,    0.491,
Ba Hg S Se      ,  5.334,    0.492,
Ba F Fe O       ,   5.34,    0.493,
F N O Zr        ,  5.344,    0.493,
As Bi Cl Hg     ,  5.345,    0.493,
Bi Pb S Se      ,  5.348,    0.494,
F In N O        ,  5.349,    0.494,
Br Dy O W       ,   5.35,    0.494,
F K O Tc        ,   5.35,    0.494,
Cl Na O W       ,  5.352,    0.494,
Bi Cl F O       ,  5.357,    0.495,
Br Cl N Sr      ,  5.357,    0.495,
Br Cl K W       ,  5.358,    0.495,
B Er F O        ,  5.359,    0.495,
Cl Li N Ti      ,   5.36,    0.495,
As Eu O Ta      ,   5.36,    0.496,
Cl F Rb Sb      ,   5.36,    0.496,
B Eu F O        ,  5.365,    0.496,
F O Sr Y        ,  5.368,    0.497,
Br Cl Tl Tl     ,   5.37,    0.497,
Cl K Re S       ,  5.371,    0.497,
Al F K O        ,  5.372,    0.497,
F La N Si       ,  5.373,    0.497,
N O Si Y        ,  5.376,    0.498,
Cl O Sm Ta      ,  5.378,    0.498,
F K O Ti        ,  5.379,    0.498,
Ce F Mn N       ,   5.38,    0.499,
As Cu O Th      ,  5.381,    0.499,
Ba F O Ti       ,  5.383,    0.499,
Cl O Re Re      ,  5.384,    0.499,
F K Mo O        ,  5.384,    0.499,
F K O V         ,  5.386,    0.499,
Ba F O Pd       ,  5.387,      0.5,
B I O Pb        ,  5.388,      0.5,
F K Nb O        ,   5.39,      0.5,
Br Ho O W       ,   5.39,      0.5,
Ba F O V        ,   5.39,      0.5,
F N O Sb        ,  5.392,      0.5,
Cl Li N Zr      ,  5.393,    0.501,
Ba F Nb O       ,  5.394,    0.501,
Cr F K O        ,  5.396,    0.501,
Cl F N O        ,  5.399,    0.501,
Br La O Pb      ,    5.4,    0.502,
B F O Tm        ,  5.402,    0.502,
Br Cs Se Tc     ,  5.407,    0.503,
Cl N Pt S       ,   5.41,    0.503,
C N Se Se       ,  5.412,    0.503,
C F O Te        ,  5.412,    0.503,
F K O Zr        ,  5.412,    0.503,
Ba Br Ca F      ,  5.416,    0.504,
Bi La O Se      ,  5.416,    0.504,
Br Cl Pb Tl     ,   5.42,    0.505,
Ba F O Sc       ,   5.42,    0.505,
Ba F In O       ,  5.421,    0.505,
Au C Cl S       ,  5.423,    0.505,
Br Er O W       ,  5.423,    0.505,
Mo N O Y        ,  5.425,    0.505,
Bi Cl Hg S      ,  5.425,    0.505,
Ba Br Cl Sr     ,  5.429,    0.506,
Cu O P U        ,  5.431,    0.506,
Ag As O Th      ,  5.435,    0.507,
Br Cs Mo Se     ,  5.441,    0.508,
Ca F O Ta       ,  5.442,    0.508,
Cl Gd O W       ,  5.443,    0.508,
Cl Nb O Rb      ,  5.448,    0.509,
B Cl K O        ,  5.451,    0.509,
Cl Cr O Rb      ,  5.454,     0.51,
Cu O P Th       ,  5.454,     0.51,
B Ba Cl O       ,  5.455,     0.51,
Cl O Re Sr      ,  5.457,     0.51,
Br Rb Re S      ,  5.457,     0.51,
Bi Br Ca O      ,  5.459,    0.511,
F K O Sb        ,   5.46,    0.511,
Cs Mo S Se      ,   5.46,    0.511,
B F O Pb        ,  5.461,    0.511,
Bi Se Te Tl     ,  5.465,    0.511,
Fe O P Th       ,  5.465,    0.511,
Br O Tm W       ,  5.466,    0.512,
Bi Cl O Y       ,  5.466,    0.512,
Br I N Sr       ,  5.469,    0.512,
Cl O Tb W       ,  5.471,    0.512,
Hg I Pb S       ,  5.472,    0.512,
C N P Se        ,  5.472,    0.513,
Br Cs S Tc      ,  5.475,    0.513,
Ce N O Se       ,  5.478,    0.513,
C N S Se        ,  5.479,    0.514,
Cl F Na Pb      ,   5.48,    0.514,
Eu Eu F S       ,   5.48,    0.514,
Bi La O S       ,  5.484,    0.514,
B Ca Cl N       ,  5.484,    0.514,
Bi Br Cl Tl     ,  5.484,    0.514,
Cl Cs Ga Se     ,  5.486,    0.515,
I O Sm Sm       ,  5.486,    0.515,
Au Br Cl K      ,  5.488,    0.515,
N O Pr Se       ,  5.491,    0.515,
As F O Rb       ,  5.492,    0.515,
F K O Te        ,  5.496,    0.516,
C N S Zn        ,  5.496,    0.516,
Bi Br O Pr      ,  5.498,    0.516,
Bi Ce O S       ,  5.503,    0.517,
F O Rb Se       ,  5.504,    0.517,
F Nd O Ta       ,  5.505,    0.517,
Cl Dy O W       ,  5.505,    0.517,
Br La N O       ,  5.506,    0.518,
Ag O P Th       ,  5.508,    0.518,
Br Cs Mo S      ,  5.508,    0.518,
F I N O         ,   5.51,    0.518,
Br Cs Nb S      ,  5.514,    0.519,
N Nd O Se       ,  5.515,    0.519,
Bi F S Sr       ,  5.518,    0.519,
B F O Yb        ,   5.52,     0.52,
Bi K S Se       ,  5.521,     0.52,
Bi Br Nd O      ,  5.522,     0.52,
Ca N O Si       ,  5.524,     0.52,
Br O Pb W       ,  5.524,     0.52,
B Bi F O        ,  5.525,     0.52,
La N O S        ,  5.525,     0.52,
B Br N Sr       ,  5.525,     0.52,
F Na O Ta       ,  5.528,    0.521,
La N O Si       ,  5.529,    0.521,
Br Lu O Ta      ,   5.53,    0.521,
F N Na Zr       ,  5.531,    0.521,
F Na O W        ,  5.535,    0.522,
Br N O Pr       ,  5.539,    0.523,
C N P S         ,  5.539,    0.523,
C Cu N S        ,  5.541,    0.523,
C Co N S        ,  5.542,    0.523,
C N Ni S        ,  5.544,    0.523,
Cl Ho O W       ,  5.544,    0.523,
Bi Br Na O      ,  5.545,    0.523,
O Rb Sb Te      ,  5.546,    0.524,
Cl Cs Fe Se     ,  5.548,    0.524,
Ce N O Si       ,  5.549,    0.524,
C N S Si        ,   5.55,    0.524,
Cl Hg O W       ,  5.552,    0.525,
Br Hg Hg O      ,  5.554,    0.525,
Cl La O Pb      ,  5.554,    0.525,
F Gd Nd O       ,  5.559,    0.526,
N O Pr Si       ,  5.562,    0.526,
F O P Rb        ,  5.564,    0.526,
Ge Li N O       ,  5.565,    0.527,
B F N O         ,  5.566,    0.527,
Ba Ca Cl F      ,  5.569,    0.527,
Cl O P U        ,   5.57,    0.527,
F O Rb S        ,   5.57,    0.527,
F Li O Ta       ,  5.572,    0.528,
Ca Mo N O       ,  5.572,    0.528,
La N O Ti       ,  5.572,    0.528,
F Li O Re       ,  5.573,    0.528,
Bi I O Y        ,  5.575,    0.528,
F I K O         ,  5.576,    0.528,
Cl Er O W       ,  5.576,    0.528,
F O Os Os       ,  5.577,    0.528,
Bi Br O Sm      ,  5.577,    0.528,
Ca N Nb O       ,  5.578,    0.528,
La N O V        ,  5.579,    0.529,
F Li O W        ,  5.579,    0.529,
Bi Br O Ta      ,   5.58,    0.529,
Br O W Yb       ,  5.583,    0.529,
La N Nb O       ,  5.583,    0.529,
F O Pb Y        ,  5.583,    0.529,
Br Cl Cs Cu     ,  5.584,    0.529,
C Cl Gd I       ,  5.585,     0.53,
N Nd O Si       ,  5.586,     0.53,
Bi Br O W       ,  5.587,     0.53,
Bi Cl Hg Te     ,  5.589,     0.53,
Bi Br Li O      ,  5.589,     0.53,
Ce N O Ti       ,  5.592,    0.531,
B Ca I N        ,  5.593,    0.531,
C Cd N S        ,  5.593,    0.531,
Ga Li N O       ,  5.593,    0.531,
Ag C N S        ,  5.594,    0.531,
O P Te U        ,  5.599,    0.532,
C I O Y         ,  5.599,    0.532,
La N O Zr       ,  5.604,    0.532,
N O Pr Ti       ,  5.604,    0.532,
Bi O Se Sr      ,  5.605,    0.533,
Br C O Re       ,  5.605,    0.533,
Ba Br N P       ,  5.607,    0.533,
Ba Br O Pr      ,  5.608,    0.533,
Br C O W        ,  5.611,    0.533,
Bi Ca Cl O      ,  5.612,    0.534,
Cl Hg O Sr      ,  5.617,    0.534,
Hg I Na O       ,  5.618,    0.535,
Cl O Tm W       ,  5.618,    0.535,
Cl F N Re       ,   5.62,    0.535,
Al N Nd O       ,  5.621,    0.535,
F Mo O Rb       ,  5.622,    0.535,
F O Rb V        ,  5.624,    0.535,
Gd N O Se       ,  5.626,    0.536,
Cl O Tl W       ,  5.627,    0.536,
F Nb O Rb       ,  5.628,    0.536,
N Nd O Ti       ,  5.628,    0.536,
C O Os S        ,  5.629,    0.536,
As Ba O Ta      ,   5.63,    0.536,
Mn N O Ta       ,   5.63,    0.536,
B F K O         ,  5.631,    0.537,
Bi Br Gd O      ,  5.633,    0.537,
Cr F O Rb       ,  5.634,    0.537,
B Ba F O        ,  5.635,    0.537,
N Nd O V        ,  5.635,    0.537,
N O Pr Zr       ,  5.636,    0.537,
Eu F La O       ,   5.64,    0.538,
N O Si Sm       ,   5.64,    0.538,
Br Cl Cs Mo     ,  5.641,    0.538,
Li N O P        ,  5.641,    0.538,
B Br Eu N       ,  5.643,    0.538,
Bi F O Y        ,  5.645,    0.539,
C N S Sn        ,  5.646,    0.539,
Cl Eu O Sr      ,  5.647,    0.539,
Li N O S        ,  5.648,    0.539,
Bi Cl O Pr      ,  5.649,    0.539,
F O Rb Zr       ,  5.649,    0.539,
Bi Br O Sr      ,  5.652,     0.54,
Li N O Si       ,  5.652,     0.54,
Br Cl Cr Cs     ,  5.652,     0.54,
N O Se Tb       ,  5.653,     0.54,
Ba Cl F Na      ,  5.653,     0.54,
Bi Cl N S       ,  5.654,     0.54,
Mo N Na O       ,  5.656,     0.54,
Ga N O Sr       ,  5.656,     0.54,
Ba Br Eu I      ,  5.657,    0.541,
Cl Cs Mo S      ,  5.659,    0.541,
Bi Br O Tb      ,   5.66,    0.541,
N Nd O Zr       ,   5.66,    0.541,
B Ca F N        ,  5.663,    0.541,
Cl Cs Nb S      ,  5.664,    0.542,
Cl O Pb Re      ,  5.669,    0.542,
C Cl N P        ,  5.671,    0.543,
Bi Cl Nd O      ,  5.673,    0.543,
C Cl Co N       ,  5.674,    0.543,
Cl O Pb W       ,  5.675,    0.543,
B Cl N Sr       ,  5.675,    0.543,
C Cl N S        ,  5.678,    0.544,
As B Cs P       ,  5.685,    0.545,
Cl F K Re       ,  5.685,    0.545,
Cl Lu O W       ,  5.687,    0.545,
Mo N O Sm       ,  5.688,    0.545,
Ba Br O Re      ,   5.69,    0.545,
Bi Br Dy O      ,  5.693,    0.546,
Li N O Ti       ,  5.694,    0.546,
F O Rb Sb       ,  5.695,    0.546,
Bi Cl Na O      ,  5.695,    0.546,
Eu F Nd O       ,  5.695,    0.546,
Gd N O Si       ,  5.696,    0.546,
Cs I Mo Se      ,    5.7,    0.547,
Li N O V        ,  5.701,    0.547,
N O P Sr        ,  5.703,    0.547,
Cl Hg Hg O      ,  5.704,    0.548,
Li N Nb O       ,  5.705,    0.548,
Cr Li N O       ,   5.71,    0.549,
N O Sm Zr       ,  5.714,    0.549,
N O Si Sr       ,  5.714,    0.549,
Mg N O Ta       ,  5.714,    0.549,
Al C Cl N       ,  5.717,     0.55,
Bi Ca I O       ,  5.718,     0.55,
N O Sc Ta       ,   5.72,     0.55,
Bi I La O       ,  5.723,     0.55,
Bi Cl O Sm      ,  5.726,    0.551,
Ba Br Eu F      ,  5.727,    0.551,
Bi Cl O Ta      ,  5.729,    0.551,
Bi Br Ho O      ,  5.731,    0.552,
Cl O W Yb       ,  5.732,    0.552,
F Np O P        ,  5.732,    0.552,
Bi Cl O W       ,  5.736,    0.552,
Bi Cl Li O      ,  5.738,    0.553,
Ba Br Cl N      ,  5.744,    0.554,
Br Cs I Pd      ,  5.745,    0.554,
Br O Pb Tl      ,  5.751,    0.555,
Cl K O Pr       ,  5.753,    0.555,
C Cl O Re       ,  5.754,    0.555,
Bi I O Pr       ,  5.755,    0.555,
Ba Cl N P       ,  5.755,    0.555,
Ba Cl F Sr      ,  5.758,    0.556,
C Cl O Os       ,  5.759,    0.556,
Mo N O Sr       ,  5.761,    0.556,
Bi Br Er O      ,  5.762,    0.556,
I La N O        ,  5.763,    0.556,
N Nb O Sr       ,  5.766,    0.557,
Bi Br Eu O      ,  5.768,    0.557,
Cl N O Re       ,   5.77,    0.557,
As C F N        ,  5.776,    0.558,
Bi I Nd O       ,  5.778,    0.559,
F S Yb Yb       ,   5.78,    0.559,
B I N Sr        ,  5.781,    0.559,
Bi Cl Gd O      ,  5.781,    0.559,
Ce I N O        ,  5.782,    0.559,
Br Ca N Sr      ,  5.787,     0.56,
Cl O Pu Te      ,  5.788,     0.56,
F F N Re        ,  5.795,    0.561,
Cl F Pb Pb      ,  5.795,    0.561,
Bi Cl O Sr      ,  5.799,    0.562,
Bi I Na O       ,    5.8,    0.562,
C Cl N Sb       ,    5.8,    0.562,
Bi Br O Tm      ,  5.802,    0.562,
Cl K N Ti       ,  5.803,    0.563,
F I O Rb        ,  5.806,    0.563,
Bi Cl O Tb      ,  5.807,    0.563,
Hg Hg I O       ,  5.808,    0.563,
C Ca F O        ,   5.81,    0.564,
Br F K Pb       ,  5.813,    0.564,
C F La O        ,  5.815,    0.564,
Er F O Sr       ,  5.815,    0.564,
B La N O        ,  5.816,    0.565,
Ba Br F Pb      ,  5.816,    0.565,
Br Cs F Nb      ,   5.82,    0.565,
Er N O Si       ,  5.823,    0.566,
Cl Hg O Pb      ,  5.823,    0.566,
Eu N O Si       ,  5.829,    0.566,
F O U Zr        ,  5.829,    0.566,
I Se Ta U       ,   5.83,    0.567,
Bi I O Sm       ,  5.831,    0.567,
Ba Cl O Sm      ,  5.833,    0.567,
Cl K O Re       ,  5.833,    0.567,
C Ce F O        ,  5.833,    0.567,
Ba Cl O Ta      ,  5.835,    0.567,
Ba Cl O Re      ,  5.837,    0.568,
Cl Cs Cu I      ,  5.837,    0.568,
Cl K O Os       ,  5.838,    0.568,
Cl K O W        ,  5.839,    0.568,
Bi Cl Dy O      ,  5.839,    0.568,
F O Pb Ta       ,   5.84,    0.568,
Bi I Li O       ,  5.842,    0.568,
Ba Cl O Os      ,  5.842,    0.568,
Ba Cl O W       ,  5.842,    0.568,
Gd N O Te       ,  5.847,    0.569,
F O Pb W        ,  5.848,    0.569,
Ba Br I N       ,  5.848,    0.569,
B F N Sr        ,  5.848,    0.569,
Ce F N O        ,  5.849,     0.57,
C F N S         ,  5.851,     0.57,
O S U Y         ,  5.854,     0.57,
Bi Br O Pb      ,  5.857,    0.571,
C I O Re        ,  5.857,    0.571,
Ba I N P        ,  5.859,    0.571,
Br Cs F Sn      ,  5.861,    0.571,
Al Eu N O       ,  5.863,    0.572,
C I O Os        ,  5.863,    0.572,
Eu Eu I O       ,  5.867,    0.572,
As Cl Hg U      ,  5.868,    0.572,
Bi Br Lu O      ,  5.869,    0.573,
Eu N O Ti       ,  5.869,    0.573,
Ba Cl Eu F      ,  5.872,    0.573,
F O Sb U        ,  5.873,    0.573,
Bi Cl Ho O      ,  5.876,    0.574,
Eu N Nb O       ,   5.88,    0.574,
Br C O Pb       ,   5.88,    0.574,
Au C Cl O       ,  5.881,    0.574,
Lu O S Yb       ,  5.883,    0.575,
Bi Gd I O       ,  5.884,    0.575,
Cl Cs I Pd      ,   5.89,    0.576,
B Eu I N        ,  5.894,    0.576,
Er N O Zr       ,  5.894,    0.576,
Bi F O Ta       ,    5.9,    0.577,
Bi I O Sr       ,  5.902,    0.578,
Bi Cl Er O      ,  5.906,    0.578,
F O Te U        ,  5.907,    0.578,
Bi I O Tb       ,   5.91,    0.579,
Ce F K O        ,  5.912,    0.579,
Bi Cl Eu O      ,  5.912,    0.579,
Bi Br O Yb      ,  5.912,    0.579,
Cl Hf N Na      ,  5.913,    0.579,
C C O Se        ,  5.917,     0.58,
Cs O P S        ,  5.921,     0.58,
O Rb Re S       ,   5.93,    0.582,
Ca Cl N Sr      ,  5.931,    0.582,
Cs Fe O S       ,  5.933,    0.582,
I La N Na       ,  5.936,    0.583,
F N O Re        ,   5.94,    0.583,
Bi Dy I O       ,  5.941,    0.583,
F N O W         ,  5.945,    0.584,
Bi Cl O Tm      ,  5.946,    0.584,
Cl N Na W       ,  5.948,    0.585,
As Cs O Sn      ,  5.949,    0.585,
Ce I N Na       ,  5.955,    0.585,
C I O Pt        ,  5.955,    0.586,
Cl F K Pb       ,  5.956,    0.586,
Br Cs Mo O      ,  5.959,    0.586,
Cl Cs F Nb      ,  5.963,    0.587,
C Dy I O        ,  5.964,    0.587,
I N Na Pr       ,  5.967,    0.587,
B Cl Cm O       ,  5.969,    0.588,
F Hf K O        ,  5.972,    0.588,
N O Si Yb       ,  5.972,    0.588,
Ba Bi O Se      ,  5.975,    0.589,
Cs Mo O S       ,  5.977,    0.589,
B Cl N N        ,  5.977,    0.589,
Bi Ho I O       ,  5.978,    0.589,
Cs O S V        ,  5.978,    0.589,
C C O S         ,  5.979,    0.589,
Ba Cl Hg O      ,  5.987,     0.59,
I N Na Nd       ,  5.989,    0.591,
C F O Sr        ,  5.991,    0.591,
B N O Sr        ,  5.992,    0.591,
Ge K N O        ,  5.993,    0.591,
C N O S         ,  5.994,    0.591,
C N O Si        ,  5.998,    0.592,
Bi Cl O Pb      ,  5.999,    0.592,
F K O Ta        ,    6.0,    0.592,
F K O Re        ,  6.001,    0.593,
Ba F O Ta       ,  6.003,    0.593,
Ba F O Re       ,  6.005,    0.593,
Bi Er I O       ,  6.008,    0.593,
K N O Se        ,   6.01,    0.594,
Ba F O W        ,   6.01,    0.594,
Bi Cl Lu O      ,  6.011,    0.594,
Bi Eu I O       ,  6.013,    0.594,
Bi Br K O       ,  6.016,    0.595,
Ba Bi Br O      ,  6.019,    0.595,
C Cl O Pb       ,  6.021,    0.596,
Hg I N O        ,  6.022,    0.596,
Ba Ga N O       ,  6.023,    0.596,
Cl N Rb Ti      ,  6.025,    0.596,
Cl Cs F Sb      ,  6.026,    0.596,
Ba N O Zn       ,  6.029,    0.597,
O Se Sm U       ,  6.037,    0.598,
Ag C N O        ,  6.039,    0.598,
B Ba Cl N       ,  6.042,    0.599,
Bi I O Tm       ,  6.046,    0.599,
Cl Cs O Ru      ,  6.049,      0.6,
Br Cs Re Se     ,  6.052,      0.6,
Bi Cl O Yb      ,  6.053,      0.6,
Ba Cl O Tl      ,  6.057,    0.601,
Au I K O        ,  6.059,    0.601,
Ba F I Pb       ,   6.06,    0.601,
Ba N O P        ,  6.068,    0.603,
K N O S         ,   6.07,    0.603,
C F Hg O        ,  6.072,    0.603,
Cs S Se W       ,  6.075,    0.604,
Ba N O Si       ,  6.078,    0.604,
C Ca N S        ,  6.084,    0.605,
Cl Hg Te U      ,  6.092,    0.606,
Bi I O Pb       ,  6.099,    0.607,
Cl Cs Mo O      ,  6.099,    0.607,
B Eu N O        ,  6.101,    0.608,
Cl Cs Nb O      ,  6.104,    0.608,
Cl Cr Cs O      ,   6.11,    0.609,
Bi I Lu O       ,   6.11,    0.609,
Br Cs Re S      ,  6.113,    0.609,
Ba N O Ti       ,  6.117,     0.61,
Cl La O U       ,  6.118,     0.61,
K Mo N O        ,  6.118,     0.61,
Ba Mo N O       ,  6.122,    0.611,
Ba N O V        ,  6.123,    0.611,
Ba N Nb O       ,  6.127,    0.612,
Ce F O Rb       ,  6.129,    0.612,
C F O Tl        ,  6.141,    0.614,
As Cs F O       ,  6.143,    0.614,
Cl O Pr U       ,  6.147,    0.615,
Bi I O Yb       ,  6.152,    0.615,
Cs F O Se       ,  6.154,    0.616,
Bi Cl K O       ,  6.154,    0.616,
Ba Bi Cl O      ,  6.158,    0.616,
C N Na S        ,  6.161,    0.617,
Bi F O Pb       ,  6.163,    0.617,
Cl Nd O U       ,  6.169,    0.618,
Ca N O Ta       ,  6.169,    0.618,
C I N Y         ,  6.172,    0.618,
La N O Ta       ,  6.174,    0.619,
Ca N O W        ,  6.176,    0.619,
Ba C Cl O       ,   6.18,     0.62,
Ba O Te Yb      ,   6.18,     0.62,
La N O W        ,   6.18,     0.62,
C F O Pb        ,  6.185,     0.62,
F Hf O Rb       ,  6.187,    0.621,
Cl K N O        ,  6.191,    0.621,
Ce N O Ta       ,  6.191,    0.621,
F N O Pb        ,    6.2,    0.623,
N O Pr Ta       ,  6.203,    0.623,
B Ba F N        ,  6.204,    0.623,
Cs F O P        ,  6.208,    0.624,
C Cl La N       ,   6.21,    0.624,
Cs F O S        ,  6.214,    0.625,
F O Rb Ta       ,  6.214,    0.625,
F O Rb W        ,  6.221,    0.626,
N Nd O W        ,  6.231,    0.627,
Br Cl Cs Re     ,  6.232,    0.628,
Br Cl Cs W      ,  6.238,    0.628,
Hf N O Ta       ,  6.249,     0.63,
Cl Cs Re S      ,  6.249,     0.63,
N Na O W        ,  6.251,     0.63,
Bi I K O        ,  6.252,     0.63,
Ba Bi I O       ,  6.255,    0.631,
Cs F O Ti       ,  6.256,    0.631,
C N S Sr        ,  6.258,    0.631,
Cs F Mo O       ,   6.26,    0.632,
Cs F O V        ,  6.262,    0.632,
Cs F Nb O       ,  6.265,    0.632,
Er O S U        ,  6.267,    0.633,
Cr Cs F O       ,  6.271,    0.633,
N O Sm Ta       ,  6.273,    0.634,
C Hg N Se       ,  6.277,    0.634,
N O Rb S        ,  6.283,    0.635,
Li N O Ta       ,  6.284,    0.635,
Cs I Re Se      ,  6.287,    0.636,
Cl Cs Dy Se     ,  6.291,    0.636,
Bi F K O        ,  6.314,     0.64,
Ba Bi F O       ,  6.318,     0.64,
Cl Cs Ho Se     ,  6.325,    0.642,
Cs F O Sb       ,  6.325,    0.642,
Mo N O Rb       ,  6.329,    0.642,
C F K O         ,  6.335,    0.643,
C Hg N S        ,  6.336,    0.643,
F Na Np O       ,  6.336,    0.643,
Ba C F O        ,  6.339,    0.644,
N O Sr Ta       ,   6.34,    0.644,
B Ba N O        ,   6.34,    0.644,
Cs I Re S       ,  6.345,    0.644,
N O Sr W        ,  6.346,    0.645,
Cl Cs Dy S      ,  6.349,    0.645,
F K N O         ,   6.35,    0.645,
Cs F O Te       ,  6.357,    0.646,
C Eu N S        ,  6.362,    0.647,
C F La N        ,  6.368,    0.648,
C N O Y         ,   6.37,    0.648,
Br Cl Cs Hg     ,  6.373,    0.649,
C Cl N Sr       ,  6.375,    0.649,
Cl Cs Ho S      ,  6.383,     0.65,
Ba Cl N Ta      ,  6.387,    0.651,
Cl K N Os       ,   6.39,    0.651,
Ba Cl N W       ,  6.393,    0.652,
As N O Th       ,  6.397,    0.652,
C N S Tl        ,  6.402,    0.653,
O S U Yb        ,  6.406,    0.654,
Cs F I O        ,  6.426,    0.657,
Eu N O Ta       ,  6.443,    0.659,
C N Pb S        ,  6.443,    0.659,
N O S U         ,  6.445,     0.66,
Eu N O W        ,   6.45,     0.66,
C Cl Hg N       ,  6.451,    0.661,
N O P Th        ,  6.459,    0.662,
C Cl Eu N       ,  6.478,    0.665,
F N N W         ,  6.488,    0.666,
Cl Cs Dy Te     ,  6.489,    0.666,
C Ca N O        ,  6.496,    0.667,
C La N O        ,    6.5,    0.668,
Br C C N        ,  6.502,    0.668,
Bi Cs Se Te     ,  6.518,    0.671,
Cl Cs Ho Te     ,  6.522,    0.671,
C N O Pr        ,  6.528,    0.672,
C K N Se        ,  6.532,    0.673,
C F O Rb        ,  6.539,    0.674,
C N Nd O        ,  6.548,    0.675,
C N Na O        ,  6.568,    0.678,
C Eu I N        ,   6.57,    0.679,
Br C K N        ,  6.573,    0.679,
N O W Yb        ,  6.579,     0.68,
F O Tl U        ,  6.582,     0.68,
Cl F Sb Xe      ,  6.586,    0.681,
C K N S         ,  6.588,    0.681,
Ba C N S        ,  6.592,    0.682,
C N O Sm        ,  6.595,    0.682,
C N O Re        ,  6.598,    0.683,
C Li N O        ,  6.605,    0.684,
Cl K O U        ,  6.614,    0.685,
C Eu F N        ,   6.63,    0.688,
C C Cl N        ,  6.631,    0.688,
Cl Cs O Re      ,   6.65,    0.691,
Cl Cs O Os      ,  6.655,    0.691,
C N O Sr        ,  6.658,    0.692,
Ba N O Ta       ,   6.67,    0.694,
Ba N O Re       ,  6.671,    0.694,
K N O Os        ,  6.673,    0.694,
K N O W         ,  6.673,    0.694,
Ba N O Os       ,  6.676,    0.695,
Ba N O W        ,  6.676,    0.695,
C Dy N O        ,  6.693,    0.697,
As F O Xe       ,  6.693,    0.697,
F O Se Xe       ,  6.704,    0.699,
F N O U         ,  6.709,      0.7,
Ce Cs F O       ,  6.719,    0.701,
C Ho N O        ,  6.725,    0.702,
C Hg N O        ,  6.732,    0.703,
Hg N N O        ,  6.745,    0.705,
F K Np O        ,  6.752,    0.706,
C Er N O        ,  6.752,    0.706,
C Eu N O        ,  6.757,    0.707,
F O S Xe        ,  6.758,    0.707,
F K O U         ,  6.763,    0.708,
F O Tc Xe       ,  6.774,    0.709,
C N O Tm        ,  6.786,    0.711,
C N O Tl        ,  6.794,    0.712,
Cs F O Ta       ,  6.797,    0.713,
Cs F O Re       ,  6.798,    0.713,
Cs F O W        ,  6.803,    0.714,
Am F K O        ,  6.811,    0.715,
Cl O Pu Rb      ,  6.854,    0.721,
F O Sb Xe       ,  6.861,    0.723,
N O Os Rb       ,  6.866,    0.723,
N O Rb W        ,  6.866,    0.723,
C N O Yb        ,  6.881,    0.726,
F O Te Xe       ,   6.89,    0.727,
Cs Mo N O       ,  6.902,    0.729,
Ca N O Th       ,  6.932,    0.733,
C K N O         ,   6.97,    0.739,
O Te U U        ,  6.983,    0.741,
I N N Rb        ,  6.993,    0.743,
Br K N Th       ,  7.004,    0.744,
C Cs F O        ,  7.095,    0.758,
C N O Rb        ,  7.155,    0.767,
Cs Gd N Te      ,  7.202,    0.774,
Cs N Tb Te      ,  7.223,    0.777,
Br Cs O U       ,   7.23,    0.778,
C Cs N Se       ,  7.271,    0.785,
F O Re Xe       ,  7.299,    0.789,
F O Os Xe       ,  7.304,     0.79,
F O W Xe        ,  7.304,     0.79,
C Cs N S        ,  7.322,    0.792,
Cl Cs Np O      ,  7.334,    0.794,
Cl Cs O U       ,  7.345,    0.796,
Cl Cs O Pu      ,  7.386,    0.802,
Cs N O Os       ,  7.398,    0.804,
Cs N O W        ,  7.398,    0.804,
Cs F O U        ,   7.48,    0.816,
Cs I N N        ,  7.515,    0.822,
F N O Xe        ,  7.589,    0.833,
F K O Xe        ,  7.637,     0.84,
C Cs N O        ,  7.667,    0.845,
Cl O Rb Xe      ,  7.678,    0.846,
Cl Cs O Xe      ,  8.157,    0.919,
Cs F O Xe       ,  8.278,    0.937,
F O Xe Xe       ,  8.694,      1.0,
