Phase fields,     scores,     Norm. scores,
As Ga Se Zn     ,  0.758,      0.0,
As Cu Ge Se     ,  0.857,    0.025,
As Ge P Zn      ,  0.916,     0.04,
Ga P Se Zn      ,  0.993,     0.06,
As Ga S Zn      ,  0.993,     0.06,
As Cu Mn P      ,  1.011,    0.064,
Cu Ge P Se      ,   1.07,    0.079,
As Cd Ga Se     ,  1.086,    0.083,
As Co Ni S      ,  1.095,    0.085,
As In Se Zn     ,  1.123,    0.093,
Cu Ga S Se      ,  1.137,    0.096,
As P Si Zn      ,  1.167,    0.104,
Fe Mn S Se      ,  1.167,    0.104,
As Cu In Se     ,  1.175,    0.106,
Ga P S Zn       ,  1.181,    0.108,
Cu Fe S Se      ,  1.183,    0.108,
As Cd P Zn      ,  1.194,    0.111,
As Ga Te Zn     ,  1.196,    0.111,
As Cd Ge P      ,  1.201,    0.112,
As Ga Mn N      ,  1.206,    0.114,
As Cr Cu Se     ,  1.214,    0.116,
Cu Ge P S       ,  1.247,    0.124,
As Cd Ga S      ,  1.261,    0.128,
Br Cu Ge S      ,  1.261,    0.128,
As Cr Mn P      ,  1.288,    0.135,
Br Cu P Se      ,  1.314,    0.141,
As Br Cu S      ,  1.314,    0.141,
Cu Ga Se Te     ,  1.318,    0.142,
Al S Se Zn      ,  1.324,    0.144,
Cd Ga S Se      ,  1.333,    0.146,
Cd S Se Zn      ,  1.343,    0.149,
Cd Ge S Se      ,  1.349,     0.15,
Br Cu In Se     ,  1.351,     0.15,
In S Se Zn      ,  1.364,    0.154,
Ni P S Se       ,  1.364,    0.154,
Ag Ga S Se      ,  1.366,    0.154,
As Cd In Se     ,  1.366,    0.154,
Al Cu S Se      ,  1.368,    0.155,
Cu P S Se       ,  1.371,    0.156,
Br Cr Cu Se     ,  1.385,    0.159,
Cl Ga P Se      ,  1.391,    0.161,
Fe In S Se      ,  1.394,    0.161,
In Mn S Se      ,  1.394,    0.161,
Cr S Se Zn      ,  1.398,    0.162,
As Cd Cr Se     ,    1.4,    0.163,
In Ni S Se      ,    1.4,    0.163,
As As Cd Cl     ,  1.402,    0.163,
Cu In S Se      ,  1.407,    0.165,
Ga S Se V       ,   1.42,    0.168,
As Br Cd P      ,  1.422,    0.169,
Cu Rh S Se      ,  1.423,    0.169,
As Cd Ga Te     ,  1.426,     0.17,
Cr Fe S Se      ,  1.427,     0.17,
Cr Mn S Se      ,  1.427,     0.17,
Co Cr S Se      ,  1.429,     0.17,
Ga Mo S Se      ,  1.436,    0.172,
Cr Cu S Se      ,   1.44,    0.173,
Cl Cu P Se      ,  1.442,    0.174,
As Cl Cu S      ,  1.442,    0.174,
Cu Ge I Se      ,  1.446,    0.175,
Br Cu S Si      ,  1.453,    0.177,
Br Mn Sb Se     ,  1.461,    0.178,
Br Cu P S       ,  1.462,    0.179,
As In Mn N      ,  1.463,    0.179,
N P Se Zn       ,  1.466,     0.18,
Cu S Se V       ,   1.47,    0.181,
Ag Br Ge S      ,   1.47,    0.181,
Mn Mo S Se      ,  1.473,    0.182,
Mo Ni S Se      ,  1.479,    0.183,
Cu Mo S Se      ,  1.486,    0.185,
Fe Fe S Te      ,  1.489,    0.186,
As Cu In Te     ,  1.495,    0.187,
Cd Se Te Zn     ,  1.499,    0.188,
As Cd In S      ,  1.509,    0.191,
Cu Cu S Te      ,  1.514,    0.192,
Ag Ga Se Te     ,   1.52,    0.193,
Cu S Sb Se      ,  1.525,    0.195,
Cd Mn Se Te     ,  1.526,    0.195,
Cd S Se Si      ,  1.531,    0.196,
Cu Nb S Se      ,  1.532,    0.196,
Br In In Se     ,  1.539,    0.198,
Cl Ga Sb Se     ,  1.542,    0.199,
Ag Br In Se     ,  1.548,    0.201,
Cr Se Te Zn     ,  1.549,    0.201,
Se Sn Te Zn     ,   1.55,    0.201,
Br Nb Se Se     ,  1.554,    0.202,
Ge Se Sn Te     ,  1.555,    0.202,
Cu In Se Te     ,  1.557,    0.203,
Br Cd P P       ,   1.56,    0.204,
Cd In S Se      ,   1.57,    0.206,
Cl Cu P S       ,  1.578,    0.208,
Br Co O Se      ,   1.58,    0.209,
Cu Ge I S       ,  1.582,    0.209,
Ga Mo Se Te     ,  1.584,     0.21,
Cl Ga N Se      ,  1.584,     0.21,
Br Ni O Se      ,  1.584,     0.21,
Al Cl P Se      ,  1.585,     0.21,
Ag Cl Ge S      ,  1.586,     0.21,
Cr Cu Se Te     ,  1.587,     0.21,
As As Cd I      ,  1.589,    0.211,
Br Mn S Sb      ,  1.595,    0.212,
Ag In S Se      ,  1.597,    0.213,
Cd Cr S Se      ,  1.599,    0.214,
N P S Zn        ,    1.6,    0.214,
Ga N O Zn       ,  1.608,    0.216,
Cl Mn Mn O      ,  1.608,    0.216,
Br C Se Se      ,   1.61,    0.216,
Cu Se Te V      ,  1.614,    0.217,
Al Br Sb Se     ,  1.614,    0.217,
Cu I Se Si      ,  1.617,    0.218,
Cl Fe N Se      ,  1.618,    0.218,
In S Se Sn      ,  1.618,    0.218,
Ge N O Zn       ,  1.621,    0.219,
Cu I P Se       ,  1.624,     0.22,
As Cu I S       ,  1.624,     0.22,
Br Cd Sb Se     ,   1.63,    0.221,
As Cl Co O      ,  1.632,    0.222,
Ag Ge I Se      ,  1.632,    0.222,
Ge Sb Se Te     ,  1.633,    0.222,
Br Cu In Te     ,  1.637,    0.223,
As Cl Cu O      ,  1.641,    0.224,
Br In Sb Se     ,  1.647,    0.226,
S Se Sn Sn      ,  1.648,    0.226,
As Cd In Te     ,   1.65,    0.226,
Cl Ga N P       ,  1.653,    0.227,
Al Br N Se      ,  1.654,    0.227,
Cu I In Se      ,  1.654,    0.228,
As Br F Se      ,  1.656,    0.228,
Ag Cl In Se     ,  1.658,    0.229,
In Mo S Se      ,  1.658,    0.229,
Cl N P Zn       ,   1.66,    0.229,
Ga Ga I Te      ,  1.662,    0.229,
Cl O Se Zn      ,  1.662,     0.23,
Br P S S        ,  1.664,     0.23,
Br Cu S Te      ,  1.664,     0.23,
Ag Mo S Se      ,  1.667,    0.231,
Cl Ga S Sb      ,   1.67,    0.232,
Cu Nb Se Te     ,  1.671,    0.232,
Ag Br In S      ,  1.676,    0.233,
S Sn Te Zn      ,  1.677,    0.233,
As Br Cd O      ,  1.681,    0.234,
Ag Fe S Te      ,  1.681,    0.234,
Cr Mo S Se      ,  1.686,    0.236,
Cl Co O Se      ,  1.688,    0.236,
Cl Ni O Se      ,  1.692,    0.237,
Cl Cu O Se      ,  1.697,    0.238,
As Br In O      ,  1.698,    0.239,
Cl Mn S Sb      ,  1.702,     0.24,
Ag S Sb Se      ,  1.702,     0.24,
Ag Br S Sn      ,  1.704,     0.24,
Cl Ga N S       ,  1.709,    0.241,
Ag Br Se Te     ,  1.712,    0.242,
As Cd I P       ,  1.713,    0.242,
Al Cl Sb Se     ,   1.72,    0.244,
Ag Cl Mo Se     ,  1.726,    0.246,
Al Cl Nb Se     ,  1.726,    0.246,
Cl Nb P Se      ,  1.729,    0.246,
Ag In Se Te     ,  1.731,    0.247,
Cd Cr Se Te     ,  1.733,    0.247,
N P Te Zn       ,  1.733,    0.247,
Cd Se Sn Te     ,  1.734,    0.248,
Cu I S Si       ,  1.739,    0.249,
Cl Fe N S       ,   1.74,    0.249,
Cl Cu In Te     ,  1.741,     0.25,
Cl Mo S Se      ,  1.743,     0.25,
I Mn Sb Se      ,  1.745,    0.251,
Br S S V        ,  1.746,    0.251,
Cu I P S        ,  1.746,    0.251,
Ag Cl P S       ,   1.75,    0.252,
Cl Cu N S       ,   1.75,    0.252,
Cl Fe O P       ,  1.751,    0.252,
Br Cd S Sb      ,  1.751,    0.252,
Cl Mn O P       ,  1.751,    0.252,
Ag O P Se       ,  1.751,    0.252,
Cl Co O P       ,  1.753,    0.252,
Ag Ge I S       ,  1.753,    0.253,
Br Cu Mo O      ,  1.754,    0.253,
Ag S Se Te      ,  1.757,    0.253,
Fe O Se Te      ,  1.758,    0.254,
As Cl F Se      ,  1.759,    0.254,
B O Se Zn       ,   1.76,    0.254,
Br Nb Nb Se     ,  1.761,    0.255,
C Fe O Se       ,  1.761,    0.255,
Cl Cu S Te      ,  1.767,    0.256,
Br In S Sb      ,  1.767,    0.256,
Cl In In S      ,  1.769,    0.257,
C N Se Se       ,   1.77,    0.257,
As Br F S       ,  1.775,    0.258,
Cr Cr Se Te     ,  1.776,    0.258,
Br Fe O Sb      ,  1.777,    0.259,
Br Mn O Sb      ,  1.777,    0.259,
Br Cl Cr S      ,  1.777,    0.259,
Ag Cl In S      ,  1.778,    0.259,
Cd N P S        ,  1.778,    0.259,
Br Co O Sb      ,  1.779,    0.259,
Ge N O Si       ,  1.779,    0.259,
N O P Zn        ,  1.781,     0.26,
Cl Mo Mo Se     ,  1.782,     0.26,
As Cd Cl O      ,  1.783,     0.26,
Br Cu O Sb      ,  1.787,    0.261,
F Mn Ni O       ,  1.789,    0.262,
Cl Cu In O      ,  1.789,    0.262,
C N S Zn        ,   1.79,    0.262,
C F Ge Se       ,  1.794,    0.263,
Mg N P S        ,  1.795,    0.263,
Cd Ge N O       ,  1.797,    0.264,
Cu Mo O S       ,  1.798,    0.264,
Cl Ga Sb Te     ,  1.798,    0.264,
As Cl In O      ,  1.799,    0.264,
Br Cd O P       ,  1.799,    0.264,
As F Fe O       ,  1.803,    0.265,
Ag Br In Te     ,  1.803,    0.265,
Br O Te Zn      ,  1.807,    0.266,
Mo Ru Se Te     ,  1.808,    0.266,
As F N Se       ,  1.812,    0.267,
Ag Cl Se Te     ,  1.812,    0.268,
Cl N S Se       ,  1.813,    0.268,
Br Fe N O       ,  1.813,    0.268,
C Co N S        ,  1.814,    0.268,
B Br P S        ,  1.817,    0.269,
C N Ni S        ,  1.818,    0.269,
As F S S        ,  1.819,    0.269,
Ag I In Se      ,  1.819,    0.269,
Al Cl N P       ,  1.819,    0.269,
In Sb Se Te     ,   1.82,     0.27,
C Cu N S        ,  1.823,     0.27,
Ag Sb Se Te     ,  1.828,    0.272,
Br Fe O Te      ,  1.829,    0.272,
O P P S         ,   1.83,    0.272,
Br Co O Te      ,  1.831,    0.272,
B Br O Zn       ,  1.831,    0.272,
C N P Se        ,  1.832,    0.273,
Br C Mn O       ,  1.833,    0.273,
Br Cr O Si      ,  1.834,    0.273,
Br Ni O Te      ,  1.834,    0.273,
Cd Cl O Se      ,  1.835,    0.273,
Al Cd O S       ,  1.839,    0.274,
Cl Cu O V       ,  1.839,    0.274,
Br Cu O Te      ,  1.839,    0.274,
Br Cr O P       ,   1.84,    0.275,
Cl Fe Mo O      ,  1.842,    0.275,
Cl Nb P S       ,  1.844,    0.276,
Br Cl S Sb      ,  1.847,    0.276,
Cd S Sn Te      ,  1.849,    0.277,
Cd Cl S Sb      ,  1.849,    0.277,
Cl In O Se      ,   1.85,    0.277,
Cl O Sb Zn      ,  1.852,    0.278,
Br N S V        ,  1.853,    0.278,
B Br Fe O       ,  1.853,    0.278,
B Br Mn O       ,  1.853,    0.278,
F Fe O Se       ,  1.855,    0.278,
B Br Co O       ,  1.855,    0.278,
Cl P S Ti       ,  1.855,    0.278,
Fe N O S        ,  1.856,    0.279,
Cl Mo S S       ,  1.857,    0.279,
B Br Ni O       ,  1.858,    0.279,
Ag O S Si       ,  1.859,    0.279,
Cl Nb Nb Se     ,  1.859,    0.279,
B Br Cu O       ,  1.863,    0.281,
Br C F Ge       ,  1.863,    0.281,
Cl In S Sb      ,  1.865,    0.281,
C Cl Co N       ,  1.868,    0.282,
Cu I S Sb       ,  1.869,    0.282,
Al Cl N S       ,   1.87,    0.282,
I P P Sn        ,  1.871,    0.282,
Ag S Sn Te      ,  1.872,    0.283,
As Cl F S       ,  1.872,    0.283,
Cl Fe O Sb      ,  1.874,    0.283,
C Fe O S        ,  1.874,    0.283,
C Mn O S        ,  1.874,    0.283,
Br Cd O V       ,  1.875,    0.283,
C Co O S        ,  1.876,    0.284,
Cl O Se Sn      ,  1.877,    0.284,
Cd I P S        ,   1.88,    0.285,
Ag Br Cl Te     ,  1.881,    0.285,
Cl N Sb Se      ,  1.882,    0.285,
C N S Se        ,  1.883,    0.285,
Cl Cu O Sb      ,  1.884,    0.286,
F O P Zn        ,  1.892,    0.288,
Al F Ge O       ,  1.894,    0.288,
Ag S Te V       ,  1.894,    0.288,
Cd Cl O P       ,  1.894,    0.288,
Cu I In Te      ,  1.895,    0.289,
As Br F Te      ,  1.896,    0.289,
Br F Sb Se      ,  1.897,    0.289,
Ag Cl In Te     ,  1.899,    0.289,
Cl O Te Zn      ,  1.902,     0.29,
C F Ge S        ,  1.905,    0.291,
F Mn O Si       ,  1.908,    0.292,
Cl Fe N O       ,  1.908,    0.292,
Ag N O Se       ,  1.908,    0.292,
Cl Mg O P       ,   1.91,    0.292,
Cl Mo N P       ,   1.91,    0.292,
Cl Co N O       ,   1.91,    0.292,
Ag Cl O Si      ,  1.911,    0.293,
Cl Mo O Se      ,  1.911,    0.293,
F Ga Mg O       ,  1.911,    0.293,
As F I Se       ,  1.912,    0.293,
Ag Br I S       ,  1.912,    0.293,
F Fe O P        ,  1.914,    0.293,
F Mn O P        ,  1.914,    0.293,
Ag Al Cl O      ,  1.915,    0.294,
Co F O P        ,  1.915,    0.294,
Cl Cu N O       ,  1.918,    0.294,
Cu I S Te       ,  1.919,    0.295,
As F N S        ,  1.922,    0.295,
Ag Cl S Te      ,  1.922,    0.295,
F Ge Mg O       ,  1.922,    0.295,
Cl N S S        ,  1.923,    0.296,
Cu F O P        ,  1.923,    0.296,
Cl Fe O Te      ,  1.923,    0.296,
N O S Se        ,  1.924,    0.296,
Al N O Si       ,  1.924,    0.296,
Cl Co O Te      ,  1.925,    0.296,
B Cl O Zn       ,  1.925,    0.296,
C Cl Mn O       ,  1.927,    0.297,
I S Sb Se       ,  1.928,    0.297,
Cl Cr O Si      ,  1.928,    0.297,
Cl Ni O Te      ,  1.928,    0.297,
Mn N Nb O       ,  1.929,    0.297,
I Sb Se Sn      ,  1.929,    0.297,
In S Sb Te      ,   1.93,    0.297,
Al Cl O S       ,   1.93,    0.298,
Al Cl O Sn      ,  1.932,    0.298,
Cl Cu O Te      ,  1.933,    0.298,
C N S Si        ,  1.935,    0.299,
Cl O P Sn       ,  1.935,    0.299,
C Cl Cu O       ,  1.936,    0.299,
C O Ru Se       ,  1.938,    0.299,
Fe N O Ti       ,   1.94,      0.3,
As C F S        ,   1.94,      0.3,
C N P S         ,  1.941,      0.3,
As Br F O       ,  1.941,      0.3,
Cl O Sb Se      ,  1.942,      0.3,
As Cd F O       ,  1.943,    0.301,
Ag Nb S Te      ,  1.943,    0.301,
Se Te Ti Ti     ,  1.945,    0.301,
Cl N Nb P       ,  1.946,    0.301,
Ag Br Te Te     ,  1.946,    0.301,
B Br Mg N       ,  1.946,    0.301,
Cl N S V        ,  1.946,    0.302,
B Cl Fe O       ,  1.946,    0.302,
B Cl Mn O       ,  1.946,    0.302,
B Cl Co O       ,  1.948,    0.302,
Cl N Si Ti      ,   1.95,    0.303,
B Cl Ni O       ,  1.951,    0.303,
C Cd N S        ,  1.951,    0.303,
Ag As I O       ,  1.956,    0.304,
Al Cd O Te      ,  1.956,    0.304,
Cl N P Ti       ,  1.956,    0.304,
O S Se Zr       ,  1.958,    0.304,
F Fe O S        ,  1.962,    0.306,
Ag Cl Cr O      ,  1.967,    0.307,
Cd Cl O V       ,  1.967,    0.307,
Cl F P Rh       ,  1.967,    0.307,
Cl Mo O P       ,  1.968,    0.307,
F Ge O V        ,  1.969,    0.307,
Br O S Ti       ,  1.972,    0.308,
Ag C N S        ,  1.974,    0.308,
Ag Br N O       ,  1.974,    0.309,
Al Al I Te      ,  1.979,     0.31,
As F O S        ,   1.98,     0.31,
Ag O P Te       ,   1.98,     0.31,
Br In O Te      ,  1.981,     0.31,
Cl O S Sn       ,  1.983,    0.311,
Ag S Te Te      ,  1.985,    0.311,
Br F N P        ,  1.987,    0.312,
As Cl F Te      ,  1.987,    0.312,
Cl N S Sb       ,  1.988,    0.312,
Al C Cl N       ,  1.989,    0.312,
C N S Sn        ,  1.991,    0.313,
C Cl N P        ,  1.991,    0.313,
Cl Mo Mo N      ,  1.993,    0.314,
Cd I S Sb       ,  1.995,    0.314,
Cl F Ge O       ,  1.996,    0.314,
Br Mo Te Te     ,  1.996,    0.314,
Cl Cl N V       ,  1.996,    0.314,
Cl O P Sb       ,  1.998,    0.315,
Br F S Sb       ,  2.002,    0.316,
Br C O Ru       ,  2.003,    0.316,
Ag I O Se       ,  2.003,    0.316,
Cl Nb O P       ,  2.003,    0.316,
I Nb Nb Se      ,  2.004,    0.316,
Cl N P Zr       ,  2.006,    0.317,
Cd Cl O Sb      ,  2.008,    0.317,
B Cl N P        ,   2.01,    0.318,
Cl N Sb V       ,  2.011,    0.318,
F Nb O Zn       ,  2.012,    0.318,
Ag N O S        ,  2.013,    0.319,
Cl O P Ti       ,  2.014,    0.319,
B Br I P        ,  2.015,    0.319,
Cl Mo O S       ,  2.016,    0.319,
As F I S        ,  2.016,    0.319,
Ag I S Sb       ,  2.016,    0.319,
Fe I O Sb       ,  2.018,     0.32,
I Mn O Sb       ,  2.018,     0.32,
Ag Br I Te      ,  2.025,    0.321,
F N P S         ,  2.026,    0.322,
B Br Cr O       ,  2.027,    0.322,
F O S Se        ,  2.027,    0.322,
Al F O Si       ,  2.027,    0.322,
Ag O S Te       ,  2.028,    0.322,
Cl In Nb O      ,  2.028,    0.322,
Co F O Sb       ,  2.028,    0.322,
Al Cl N O       ,  2.028,    0.322,
N O S S         ,  2.028,    0.322,
As Cl F O       ,   2.03,    0.323,
Cl N O P        ,   2.03,    0.323,
F Ni O Sb       ,  2.031,    0.323,
F Fe Nb O       ,  2.032,    0.323,
F Mn Nb O       ,  2.032,    0.323,
Cl Cl O Sn      ,  2.032,    0.323,
I S Sb Sn       ,  2.033,    0.324,
Al F O P        ,  2.033,    0.324,
I In In Te      ,  2.033,    0.324,
B Cl Mg N       ,  2.035,    0.324,
F O P P         ,  2.035,    0.324,
As C F N        ,  2.037,    0.325,
C Cl F Se       ,  2.037,    0.325,
C Cl N S        ,  2.038,    0.325,
Br Mo O Te      ,  2.038,    0.325,
Ag I In Te      ,  2.041,    0.326,
Cu F Nb O       ,  2.041,    0.326,
C O Ru S        ,  2.041,    0.326,
Br Cl I Sb      ,  2.042,    0.326,
B Mg O S        ,  2.042,    0.326,
F Fe O Ti       ,  2.042,    0.326,
Cl F P Sb       ,  2.042,    0.326,
I Nb Se Te      ,  2.045,    0.327,
Cd F O P        ,  2.046,    0.327,
C Cr O S        ,  2.046,    0.327,
F Ga O Te       ,  2.046,    0.327,
Al N Nb O       ,  2.047,    0.327,
Fe I N O        ,   2.05,    0.328,
Co I N O        ,  2.051,    0.328,
B I P S         ,  2.053,    0.329,
F Mg O Si       ,  2.054,    0.329,
Cd Cl O Te      ,  2.055,    0.329,
C C O Se        ,  2.056,    0.329,
Ag I O P        ,  2.058,     0.33,
F Mg O P        ,   2.06,     0.33,
Cl O S Ti       ,   2.06,     0.33,
Ag Cl N O       ,  2.062,    0.331,
Br C C N        ,  2.063,    0.331,
C I Mn O        ,  2.067,    0.332,
Ag F O P        ,  2.067,    0.332,
Cl In O Te      ,  2.069,    0.333,
Br Nb O Te      ,  2.072,    0.333,
N O V V         ,  2.072,    0.334,
F Fe O Te       ,  2.072,    0.334,
Cr I O P        ,  2.073,    0.334,
Mg N Nb O       ,  2.074,    0.334,
Cl F N P        ,  2.074,    0.334,
C F Mn O        ,  2.075,    0.334,
As F N O        ,  2.075,    0.334,
Ag Cl O Te      ,  2.076,    0.334,
Cl N O S        ,  2.076,    0.335,
Cl N O Sn       ,  2.078,    0.335,
C Cl O Pd       ,  2.079,    0.335,
Cu F O Te       ,  2.081,    0.336,
C Cl O Rh       ,  2.082,    0.336,
F O P Sn        ,  2.083,    0.336,
C Cu F O        ,  2.084,    0.337,
B Fe I O        ,  2.085,    0.337,
B I Mn O        ,  2.085,    0.337,
C Cl F Si       ,  2.085,    0.337,
B Co I O        ,  2.086,    0.337,
C N O Si        ,  2.087,    0.337,
C Cl O Ru       ,  2.089,    0.338,
B I Ni O        ,  2.089,    0.338,
B Cl Mg O       ,   2.09,    0.338,
Al I Sb Te      ,  2.091,    0.338,
Cl Cr O Te      ,  2.091,    0.338,
B Cu I O        ,  2.094,    0.339,
F Nb O Se       ,  2.095,    0.339,
Cl N O V        ,  2.098,     0.34,
C Cl N Sb       ,    2.1,    0.341,
F O P V         ,  2.103,    0.341,
Ag Cr I O       ,  2.104,    0.342,
Cd I O V        ,  2.104,    0.342,
Cl O S Zr       ,  2.108,    0.342,
Cl O Te V       ,  2.112,    0.344,
Ag F O S        ,  2.112,    0.344,
B Cl Cr O       ,  2.112,    0.344,
Ag N O Te       ,  2.121,    0.346,
Cl Mo O Te      ,  2.123,    0.346,
Ag C N O        ,  2.123,    0.347,
As F I Te       ,  2.123,    0.347,
F I Sb Se       ,  2.124,    0.347,
Ag I O V        ,  2.125,    0.347,
Cl Nb O Ti      ,  2.126,    0.347,
F O S Sn        ,  2.128,    0.348,
Cl F O P        ,  2.128,    0.348,
Br O Te Zr      ,  2.129,    0.348,
Cd Cl I O       ,   2.13,    0.348,
Mg N O Zr       ,  2.131,    0.348,
Cl I N V        ,  2.132,    0.349,
F O S Tc        ,  2.132,    0.349,
F N S Sb        ,  2.133,    0.349,
Ag F O V        ,  2.133,    0.349,
Cl N O Sb       ,  2.137,     0.35,
C N O S         ,  2.138,     0.35,
F O P Sb        ,  2.142,    0.351,
Cl N Nb O       ,  2.142,    0.351,
Ag F Mo O       ,  2.144,    0.352,
C C Cl N        ,  2.147,    0.352,
B Cl N N        ,  2.148,    0.353,
Cl F Sb Sb      ,  2.149,    0.353,
Br F O Sb       ,   2.15,    0.353,
Cl O Sb Te      ,  2.151,    0.353,
Cd F O Sb       ,  2.152,    0.354,
Cl N O Ti       ,  2.152,    0.354,
C Cl O Sb       ,  2.153,    0.354,
C C O S         ,  2.154,    0.354,
Cl Nb O Te      ,  2.156,    0.355,
Br C F Te       ,  2.157,    0.355,
F O Sc Se       ,  2.164,    0.357,
B I Mg N        ,  2.168,    0.358,
Cl F O Ru       ,  2.168,    0.358,
F Mg Nb O       ,   2.17,    0.358,
Cl F O S        ,  2.172,    0.359,
Ag F Nb O       ,  2.177,     0.36,
C F N S         ,  2.179,    0.361,
F Mg O Ti       ,  2.179,    0.361,
Br F N O        ,   2.18,    0.361,
F O S Sb        ,  2.185,    0.362,
Cl Nb O Sc      ,  2.186,    0.362,
Cr F Nb O       ,  2.191,    0.364,
F O Sb Tc       ,  2.191,    0.364,
Cl F Sb Te      ,  2.192,    0.364,
F Nb O Sn       ,  2.192,    0.364,
Br F O Te       ,  2.193,    0.364,
Ag I N O        ,  2.193,    0.364,
F In N O        ,  2.195,    0.365,
B F N S         ,  2.197,    0.365,
Cl N Sc Sc      ,  2.201,    0.366,
Al B F O        ,  2.203,    0.367,
Ag I O Te       ,  2.206,    0.368,
F In O Te       ,  2.208,    0.368,
Cl O Te Zr      ,   2.21,    0.369,
C I O Rh        ,  2.213,    0.369,
I Mo Te Te      ,  2.213,    0.369,
I Mo Nb O       ,  2.214,    0.369,
B Cd F O        ,  2.215,     0.37,
F Mo O Sb       ,  2.217,     0.37,
Ag C F O        ,  2.217,     0.37,
F I S Sb        ,  2.218,    0.371,
C I O Ru        ,  2.219,    0.371,
F Mo Nb O       ,  2.222,    0.371,
F Mg O Zr       ,  2.224,    0.372,
C F O Ru        ,  2.227,    0.373,
B F Mg O        ,  2.228,    0.373,
F O S Te        ,  2.228,    0.373,
Cl F O Sb       ,   2.23,    0.374,
C F O S         ,  2.231,    0.374,
C Cl F Te       ,  2.237,    0.375,
B Cr I O        ,  2.241,    0.376,
I Nb Te Te      ,  2.244,    0.377,
F O Te V        ,  2.248,    0.378,
C I Mo O        ,  2.254,     0.38,
F Mo O Te       ,  2.259,    0.381,
Cl F N O        ,  2.259,    0.381,
F Nb O Ti       ,  2.262,    0.382,
Cl F I Sb       ,  2.262,    0.382,
B Cl I Zr       ,  2.262,    0.382,
Be Cl I Zr      ,   2.27,    0.384,
F N O Sb        ,  2.272,    0.384,
N O Sc Zr       ,  2.281,    0.387,
B Cl F O        ,  2.292,    0.389,
F O Te Ti       ,  2.299,    0.391,
F Nb O Zr       ,  2.305,    0.393,
C Cl F I        ,  2.306,    0.393,
F I Sb Te       ,  2.316,    0.395,
F Nb O Sc       ,  2.318,    0.396,
C F O Te        ,  2.328,    0.398,
F N O Zr        ,  2.329,    0.399,
B F N O         ,  2.332,    0.399,
B F O Te        ,  2.345,    0.403,
F I O Sb        ,  2.352,    0.405,
F O Sc Te       ,  2.354,    0.405,
As As Re S      ,  2.362,    0.407,
As Fe La N      ,  2.366,    0.408,
As Co La N      ,  2.367,    0.408,
As La N Ni      ,   2.37,    0.409,
B Be F O        ,  2.371,    0.409,
Br Fe La S      ,  2.378,    0.411,
F I N O         ,   2.38,    0.412,
F I O Te        ,  2.392,    0.415,
As La O Zn      ,  2.397,    0.416,
Cu S Se Ta      ,  2.398,    0.416,
As Br Cu Hg     ,  2.405,    0.418,
Br Re Se Se     ,  2.408,    0.419,
As As Br Hg     ,  2.412,     0.42,
As Fe La O      ,  2.413,     0.42,
As Co La O      ,  2.415,     0.42,
As La Ni O      ,  2.417,    0.421,
Br Hg Se Zn     ,  2.419,    0.422,
Br Ce Fe S      ,  2.425,    0.423,
Ga La O Se      ,   2.43,    0.424,
La O Se Zn      ,  2.436,    0.426,
As O Y Zn       ,  2.439,    0.427,
Br Cu Hg Se     ,  2.443,    0.428,
As Cl Ga Hg     ,  2.448,    0.429,
As Br Hg Se     ,   2.45,    0.429,
Cl Fe La S      ,  2.451,     0.43,
Fe La O Se      ,  2.452,     0.43,
La Mn O Se      ,  2.452,     0.43,
Co La O Se      ,  2.453,     0.43,
F I I O         ,  2.457,    0.431,
As Ce Fe O      ,   2.46,    0.432,
Cu La O Se      ,   2.46,    0.432,
As Ce Mn O      ,   2.46,    0.432,
Ga Se Ta Te     ,   2.46,    0.432,
As Ce Ni O      ,  2.463,    0.433,
La S S Se       ,  2.464,    0.433,
Br La S Si      ,  2.472,    0.435,
As Fe P Sr      ,  2.473,    0.435,
As Ni P Sr      ,  2.477,    0.436,
Cl Re Se Se     ,  2.481,    0.437,
La O P Zn       ,  2.481,    0.437,
Ce O Se Zn      ,  2.481,    0.437,
Ga S Se Tl      ,  2.485,    0.438,
Ni Se Ta Te     ,  2.485,    0.438,
Cu Se Ta Te     ,  2.489,    0.439,
La Mo S Se      ,  2.491,     0.44,
Ce Cl Fe S      ,  2.497,    0.441,
Fe La O P       ,  2.497,    0.441,
Ce Fe O Se      ,  2.498,    0.441,
Ce Mn O Se      ,  2.498,    0.441,
Co La O P       ,  2.498,    0.442,
La Ni O P       ,  2.501,    0.442,
As Br Cd Hg     ,  2.504,    0.443,
Cu La O P       ,  2.504,    0.443,
La O Se Se      ,  2.505,    0.443,
As Fe O Pr      ,  2.506,    0.444,
Fe S Se Tl      ,  2.507,    0.444,
Cu La S Te      ,  2.508,    0.444,
Ga La O S       ,  2.513,    0.445,
Cl Cu Hg Se     ,  2.515,    0.446,
As Br Hg In     ,  2.515,    0.446,
Br Ce S Si      ,  2.518,    0.446,
As Br La O      ,  2.518,    0.447,
O P Y Zn        ,  2.522,    0.448,
Ce O P Zn       ,  2.526,    0.449,
Br Cu Hg S      ,  2.526,    0.449,
Cl P Se Ta      ,  2.528,    0.449,
As Br Hg S      ,  2.533,     0.45,
As Br Cr Hg     ,  2.533,    0.451,
As Br Hg Sn     ,  2.534,    0.451,
Ge Pb S Se      ,  2.535,    0.451,
La Mn O S       ,  2.535,    0.451,
As Nd O Zn      ,  2.538,    0.452,
Cl S Se W       ,  2.539,    0.452,
Cu La O S       ,  2.542,    0.453,
Cl La S Si      ,  2.543,    0.453,
Fe O Pr Se      ,  2.544,    0.453,
La O Se Si      ,  2.544,    0.453,
Mn O Pr Se      ,  2.544,    0.453,
As La O Ru      ,  2.545,    0.454,
As La O S       ,  2.548,    0.454,
As Cr La O      ,  2.549,    0.454,
Ce O Se Se      ,  2.549,    0.455,
As Fe Nd O      ,  2.554,    0.456,
As Mn Nd O      ,  2.554,    0.456,
As Co Nd O      ,  2.555,    0.456,
As Cl Pr S      ,  2.557,    0.456,
Ce Ga O S       ,  2.558,    0.457,
Fe I La S       ,  2.563,    0.458,
Br Pr S Si      ,  2.563,    0.458,
As Cd Ce O      ,  2.564,    0.458,
Br La S Sb      ,  2.565,    0.459,
O P Pr Zn       ,  2.571,     0.46,
Cl Hg S Zn      ,  2.572,     0.46,
Br S S Ta       ,  2.577,    0.461,
Ce Fe O S       ,  2.579,    0.462,
Ce Cu O S       ,  2.586,    0.464,
Ce Cl S Si      ,  2.587,    0.464,
Fe O P Pr       ,  2.587,    0.464,
As Cl La O      ,  2.587,    0.464,
Ce O Se Si      ,  2.588,    0.464,
Ag Au S Se      ,  2.588,    0.464,
N Pr Se Si      ,  2.589,    0.464,
As Ce O Ru      ,  2.589,    0.465,
Ag As Cl Hg     ,   2.59,    0.465,
Fe Nd O Se      ,   2.59,    0.465,
Mn Nd O Se      ,   2.59,    0.465,
Br La N S       ,  2.591,    0.465,
O Pr Se Se      ,  2.594,    0.466,
I Se Se Ta      ,  2.594,    0.466,
As Br Hg Ti     ,  2.595,    0.466,
Cl Cu Hg S      ,  2.595,    0.466,
As Bi Ni S      ,  2.595,    0.466,
Bi Br Mn Se     ,  2.598,    0.467,
Cr Hg S Se      ,    2.6,    0.467,
Cd Ce O Se      ,    2.6,    0.467,
As Cl Hg S      ,  2.601,    0.468,
As Cl Hg Sn     ,  2.603,    0.468,
Bi Br Cu Se     ,  2.605,    0.469,
Ce Fe I S       ,  2.606,    0.469,
As Br O Pr      ,  2.607,    0.469,
Cl Fe O W       ,  2.608,    0.469,
Cl P S Ta       ,  2.608,     0.47,
Br Ce S Sb      ,  2.609,     0.47,
Br Nd S Si      ,  2.609,     0.47,
Cl Ga O Re      ,   2.61,     0.47,
As Hg S Sb      ,  2.613,    0.471,
Mo Se Te W      ,  2.613,    0.471,
Br Hg P Sn      ,  2.614,    0.471,
Cl Cu O W       ,  2.615,    0.471,
Nd O P Zn       ,  2.617,    0.472,
Cl S S W        ,  2.618,    0.472,
Cl Cu O Y       ,   2.62,    0.472,
Br Cd Hg S      ,   2.62,    0.473,
Ge Pb Se Te     ,  2.621,    0.473,
Fe O Pr S       ,  2.623,    0.473,
La O S Si       ,  2.623,    0.473,
Hg Mo S Se      ,  2.626,    0.474,
Cu La O Te      ,  2.628,    0.474,
As Cl Hg Mo     ,  2.628,    0.474,
Ce Cr O Se      ,  2.629,    0.475,
As Hg I Se      ,   2.63,    0.475,
